API,Description,Auth,HTTPS,Cors,Link,Category
AdoptAPet,Resource to help get pets adopted,apiKey,True,yes,https://www.adoptapet.com/public/apis/pet_list.html,Animals
Axolotl,Collection of axolotl pictures and facts,,True,no,https://theaxolotlapi.netlify.app/,Animals
Cat Facts,Daily cat facts,,True,no,https://alexwohlbruck.github.io/cat-facts/,Animals
Cataas,Cat as a service (cats pictures and gifs),,True,no,https://cataas.com/,Animals
Cats,Pictures of cats from Tumblr,apiKey,True,no,https://docs.thecatapi.com/,Animals
Dog Facts,Random dog facts,,True,yes,https://dukengn.github.io/Dog-facts-API/,Animals
Dog Facts,Random facts of Dogs,,True,yes,https://kinduff.github.io/dog-api/,Animals
Dogs,Based on the Stanford Dogs Dataset,,True,yes,https://dog.ceo/dog-api/,Animals
eBird,Retrieve recent or notable birding observations within a region,apiKey,True,no,https://documenter.getpostman.com/view/664302/S1ENwy59,Animals
FishWatch,Information and pictures about individual fish species,,True,yes,https://www.fishwatch.gov/developers,Animals
HTTP Cat,Cat for every HTTP Status,,True,yes,https://http.cat/,Animals
HTTP Dog,Dogs for every HTTP response status code,,True,yes,https://http.dog/,Animals
IUCN,IUCN Red List of Threatened Species,apiKey,False,no,http://apiv3.iucnredlist.org/api/v3/docs,Animals
MeowFacts,Get random cat facts,,True,no,https://github.com/wh-iterabb-it/meowfacts,Animals
Movebank,Movement and Migration data of animals,,True,yes,https://github.com/movebank/movebank-api-doc,Animals
Petfinder,"Petfinder is dedicated to helping pets find homes, another resource to get pets adopted",apiKey,True,yes,https://www.petfinder.com/developers/,Animals
PlaceBear,Placeholder bear pictures,,True,yes,https://placebear.com/,Animals
PlaceDog,Placeholder Dog pictures,,True,yes,https://place.dog,Animals
PlaceKitten,Placeholder Kitten pictures,,True,yes,https://placekitten.com/,Animals
RandomDog,Random pictures of dogs,,True,yes,https://random.dog/woof.json,Animals
RandomDuck,Random pictures of ducks,,True,no,https://random-d.uk/api,Animals
RandomFox,Random pictures of foxes,,True,no,https://randomfox.ca/floof/,Animals
RescueGroups,Adoption,,True,unknown,https://userguide.rescuegroups.org/display/APIDG/API+Developers+Guide+Home,Animals
Shibe.Online,"Random pictures of Shiba Inu, cats or birds",,True,yes,http://shibe.online/,Animals
The Dog,"A public service all about Dogs, free to use when making your fancy new App, Website or Service",apiKey,True,no,https://thedogapi.com/,Animals
xeno-canto,Bird recordings,,True,unknown,https://xeno-canto.org/explore/api,Animals
Zoo Animals,Facts and pictures of zoo animals,,True,yes,https://zoo-animal-api.herokuapp.com/,Animals
AniAPI,"Anime discovery, streaming & syncing with trackers",OAuth,True,yes,https://aniapi.com/docs/,Anime
AniDB,Anime Database,apiKey,False,unknown,https://wiki.anidb.net/HTTP_API_Definition,Anime
AniList,Anime discovery & tracking,OAuth,True,unknown,https://github.com/AniList/ApiV2-GraphQL-Docs,Anime
AnimeChan,Anime quotes (over 10k+),,True,no,https://github.com/RocktimSaikia/anime-chan,Anime
AnimeFacts,Anime Facts (over 100+),,True,yes,https://chandan-02.github.io/anime-facts-rest-api/,Anime
AnimeNewsNetwork,Anime industry news,,True,yes,https://www.animenewsnetwork.com/encyclopedia/api.php,Anime
Catboy,"Neko images, funny GIFs & more",,True,yes,https://catboys.com/api,Anime
Danbooru Anime,Thousands of anime artist database to find good anime art,apiKey,True,yes,https://danbooru.donmai.us/wiki_pages/help:api,Anime
Jikan,Unofficial MyAnimeList API,,True,yes,https://jikan.moe,Anime
Kitsu,Anime discovery platform,OAuth,True,yes,https://kitsu.docs.apiary.io/,Anime
MangaDex,Manga Database and Community,apiKey,True,unknown,https://api.mangadex.org/docs.html,Anime
Mangapi,Translate manga pages from one language to another,apiKey,True,unknown,https://rapidapi.com/pierre.carcellermeunier/api/mangapi3/,Anime
MyAnimeList,Anime and Manga Database and Community,OAuth,True,unknown,https://myanimelist.net/clubs.php?cid=13727,Anime
NekosBest,Neko Images & Anime roleplaying GIFs,,True,yes,https://docs.nekos.best,Anime
Shikimori,"Anime discovery, tracking, forum, rates",OAuth,True,unknown,https://shikimori.one/api/doc,Anime
Studio Ghibli,Resources from Studio Ghibli films,,True,yes,https://ghibliapi.herokuapp.com,Anime
Trace Moe,A useful tool to get the exact scene of an anime from a screenshot,,True,no,https://soruly.github.io/trace.moe-api/#/,Anime
Waifu.im,Get waifu pictures from an archive of over 4000 images and multiple tags,,True,yes,https://waifu.im/docs,Anime
Waifu.pics,Image sharing platform for anime images,,True,no,https://waifu.pics/docs,Anime
AbuseIPDB,IP/domain/URL reputation,apiKey,True,unknown,https://docs.abuseipdb.com/,Anti-Malware
AlienVault Open Threat Exchange (OTX),IP/domain/URL reputation,apiKey,True,unknown,https://otx.alienvault.com/api,Anti-Malware
CAPEsandbox,Malware execution and analysis,apiKey,True,unknown,https://capev2.readthedocs.io/en/latest/usage/api.html,Anti-Malware
Google Safe Browsing,Google Link/Domain Flagging,apiKey,True,unknown,https://developers.google.com/safe-browsing/,Anti-Malware
MalDatabase,Provide malware datasets and threat intelligence feeds,apiKey,True,unknown,https://maldatabase.com/api-doc.html,Anti-Malware
MalShare,Malware Archive / file sourcing,apiKey,True,no,https://malshare.com/doc.php,Anti-Malware
MalwareBazaar,Collect and share malware samples,apiKey,True,unknown,https://bazaar.abuse.ch/api/,Anti-Malware
Metacert,Metacert Link Flagging,apiKey,True,unknown,https://metacert.com/,Anti-Malware
NoPhishy,Check links to see if they're known phishing attempts,apiKey,True,yes,https://rapidapi.com/Amiichu/api/exerra-phishing-check/,Anti-Malware
Phisherman,IP/domain/URL reputation,apiKey,True,unknown,https://phisherman.gg/,Anti-Malware
Scanii,Simple REST API that can scan submitted documents/files for the presence of threats,apiKey,True,yes,https://docs.scanii.com/,Anti-Malware
URLhaus,Bulk queries and Download Malware Samples,,True,yes,https://urlhaus-api.abuse.ch/,Anti-Malware
URLScan.io,Scan and Analyse URLs,apiKey,True,unknown,https://urlscan.io/about-api/,Anti-Malware
VirusTotal,VirusTotal File/URL Analysis,apiKey,True,unknown,https://www.virustotal.com/en/documentation/public-api/,Anti-Malware
Web of Trust,IP/domain/URL reputation,apiKey,True,unknown,https://support.mywot.com/hc/en-us/sections/360004477734-API-,Anti-Malware
Améthyste,Generate images for Discord users,apiKey,True,unknown,https://api.amethyste.moe/,Art & Design
Art Institute of Chicago,Art,,True,yes,https://api.artic.edu/docs/,Art & Design
Colormind,Color scheme generator,,False,unknown,http://colormind.io/api-access/,Art & Design
ColourLovers,"Get various patterns, palettes and images",,False,unknown,http://www.colourlovers.com/api,Art & Design
Cooper Hewitt,Smithsonian Design Museum,apiKey,True,unknown,https://collection.cooperhewitt.org/api,Art & Design
Dribbble,Discover the world’s top designers & creatives,OAuth,True,unknown,https://developer.dribbble.com,Art & Design
EmojiHub,Get emojis by categories and groups,,True,yes,https://github.com/cheatsnake/emojihub,Art & Design
Europeana,European Museum and Galleries content,apiKey,True,unknown,https://pro.europeana.eu/resources/apis/search,Art & Design
Harvard Art Museums,Art,apiKey,False,unknown,https://github.com/harvardartmuseums/api-docs,Art & Design
Icon Horse,"Favicons for any website, with fallbacks",,True,yes,https://icon.horse,Art & Design
Iconfinder,Icons,apiKey,True,unknown,https://developer.iconfinder.com,Art & Design
Icons8,"Icons (find ""search icon"" hyperlink in page)",,True,unknown,https://img.icons8.com/,Art & Design
Lordicon,Icons with predone Animations,,True,yes,https://lordicon.com/,Art & Design
Metropolitan Museum of Art,Met Museum of Art,,True,no,https://metmuseum.github.io/,Art & Design
Noun Project,Icons,OAuth,False,unknown,http://api.thenounproject.com/index.html,Art & Design
PHP-Noise,Noise Background Image Generator,,True,yes,https://php-noise.com/,Art & Design
Pixel Encounter,SVG Icon Generator,,True,no,https://pixelencounter.com/api,Art & Design
Rijksmuseum,RijksMuseum Data,apiKey,True,unknown,https://data.rijksmuseum.nl/object-metadata/api/,Art & Design
Word Cloud,Easily create word clouds,apiKey,True,unknown,https://wordcloudapi.com/,Art & Design
xColors,Generate & convert colors,,True,yes,https://x-colors.herokuapp.com/,Art & Design
Auth0,"Easy to implement, adaptable authentication and authorization platform",apiKey,True,yes,https://auth0.com,Authentication & Authorization
GetOTP,Implement OTP flow quickly,apiKey,True,no,https://otp.dev/en/docs/,Authentication & Authorization
Micro User Service,User management and authentication,apiKey,True,no,https://m3o.com/user,Authentication & Authorization
MojoAuth,Secure and modern passwordless authentication platform,apiKey,True,yes,https://mojoauth.com,Authentication & Authorization
SAWO Labs,Simplify login and improve user experience by integrating passwordless authentication in your app,apiKey,True,yes,https://sawolabs.com,Authentication & Authorization
Stytch,User infrastructure for modern applications,apiKey,True,no,https://stytch.com/,Authentication & Authorization
Warrant,APIs for authorization and access control,apiKey,True,yes,https://warrant.dev/,Authentication & Authorization
Bitquery,Onchain GraphQL APIs & DEX APIs,apiKey,True,yes,https://graphql.bitquery.io/ide,Blockchain
Chainlink,Build hybrid smart contracts with Chainlink,,True,unknown,https://chain.link/developer-resources,Blockchain
Chainpoint,Chainpoint is a global network for anchoring data to the Bitcoin blockchain,,True,unknown,https://tierion.com/chainpoint/,Blockchain
Covalent,Multi-blockchain data aggregator platform,apiKey,True,unknown,https://www.covalenthq.com/docs/api/,Blockchain
Etherscan,Ethereum explorer API,apiKey,True,yes,https://etherscan.io/apis,Blockchain
Helium,"Helium is a global, distributed network of Hotspots that create public, long-range wireless coverage",,True,unknown,https://docs.helium.com/api/blockchain/introduction/,Blockchain
Nownodes,Blockchain-as-a-service solution that provides high-quality connection via API,apiKey,True,unknown,https://nownodes.io/,Blockchain
Steem,Blockchain-based blogging and social media website,,False,no,https://developers.steem.io/,Blockchain
The Graph,Indexing protocol for querying networks like Ethereum with GraphQL,apiKey,True,unknown,https://thegraph.com,Blockchain
Walltime,To retrieve Walltime's market info,,True,unknown,https://walltime.info/api.html,Blockchain
Watchdata,Provide simple and reliable API access to Ethereum blockchain,apiKey,True,unknown,https://docs.watchdata.io,Blockchain
A Bíblia Digital,Do not worry about managing the multiple versions of the Bible,apiKey,True,no,https://www.abibliadigital.com.br/en,Books
Bhagavad Gita,Open Source Shrimad Bhagavad Gita API including 21+ authors translation in Sanskrit/English/Hindi,apiKey,True,yes,https://docs.bhagavadgitaapi.in,Books
Bhagavad Gita,Bhagavad Gita text,OAuth,True,yes,https://bhagavadgita.io/api,Books
Bhagavad Gita telugu,Bhagavad Gita API in telugu and odia languages,,True,yes,https://gita-api.vercel.app,Books
Bible-api,Free Bible API with multiple languages,,True,yes,https://bible-api.com/,Books
British National Bibliography,Books,,False,unknown,http://bnb.data.bl.uk/,Books
Crossref Metadata Search,Books & Articles Metadata,,True,unknown,https://github.com/CrossRef/rest-api-doc,Books
Ganjoor,"Classic Persian poetry works including access to related manuscripts, recitations and music tracks",OAuth,True,yes,https://api.ganjoor.net,Books
Google Books,Books,OAuth,True,unknown,https://developers.google.com/books/,Books
GurbaniNow,Fast and Accurate Gurbani RESTful API,,True,unknown,https://github.com/GurbaniNow/api,Books
Gutendex,Web-API for fetching data from Project Gutenberg Books Library,,True,unknown,https://gutendex.com/,Books
Open Library,"Books, book covers and related data",,True,no,https://openlibrary.org/developers/api,Books
Penguin Publishing,"Books, book covers and related data",,True,yes,http://www.penguinrandomhouse.biz/webservices/rest/,Books
PoetryDB,Enables you to get instant data from our vast poetry collection,,True,yes,https://github.com/thundercomb/poetrydb#readme,Books
Quran,RESTful Quran API with multiple languages,,True,yes,https://quran.api-docs.io/,Books
Quran Cloud,"A RESTful Quran API to retrieve an Ayah, Surah, Juz or the entire Holy Quran",,True,yes,https://alquran.cloud/api,Books
Quran-api,Free Quran API Service with 90+ different languages and 400+ translations,,True,yes,https://github.com/fawazahmed0/quran-api#readme,Books
Rig Veda,"Gods and poets, their categories, and the verse meters, with the mandal and sukta number",,True,unknown,https://aninditabasu.github.io/indica/html/rv.html,Books
The Bible,Everything you need from the Bible in one discoverable place,apiKey,True,unknown,https://docs.api.bible,Books
Thirukkural,1330 Thirukkural poems and explanation in Tamil and English,,True,yes,https://api-thirukkural.web.app/,Books
Vedic Society,"Descriptions of all nouns (names, places, animals, things) from vedic literature",,True,unknown,https://aninditabasu.github.io/indica/html/vs.html,Books
Wizard World,Get information from the Harry Potter universe,,True,yes,https://wizard-world-api.herokuapp.com/swagger/index.html,Books
Wolne Lektury,API for obtaining information about e-books available on the WolneLektury.pl website,,True,unknown,https://wolnelektury.pl/api/,Books
Apache Superset,API to manage your BI dashboards and data sources on Superset,apiKey,True,yes,https://superset.apache.org/docs/api,Business
Charity Search,Non-profit charity data,apiKey,False,unknown,http://charityapi.orghunter.com/,Business
Clearbit Logo,Search for company logos and embed them in your projects,apiKey,True,unknown,https://clearbit.com/docs#logo-api,Business
Domainsdb.info,Registered Domain Names Search,,True,no,https://domainsdb.info/,Business
Freelancer,Hire freelancers to get work done,OAuth,True,unknown,https://developers.freelancer.com,Business
Gmail,"Flexible, RESTful access to the user's inbox",OAuth,True,unknown,https://developers.google.com/gmail/api/,Business
Google Analytics,"Collect, configure and analyze your data to reach the right audience",OAuth,True,unknown,https://developers.google.com/analytics/,Business
Instatus,Post to and update maintenance and incidents on your status page through an HTTP REST API,apiKey,True,unknown,https://instatus.com/help/api,Business
Mailchimp,Send marketing campaigns and transactional mails,apiKey,True,unknown,https://mailchimp.com/developer/,Business
mailjet,Marketing email can be sent and mail templates made in MJML or HTML can be sent using API,apiKey,True,unknown,https://www.mailjet.com/,Business
markerapi,Trademark Search,,False,unknown,https://markerapi.com,Business
ORB Intelligence,Company lookup,apiKey,True,unknown,https://api.orb-intelligence.com/docs/,Business
Redash,Access your queries and dashboards on Redash,apiKey,True,yes,https://redash.io/help/user-guide/integrations-and-api/api,Business
Smartsheet,Allows you to programmatically access and Smartsheet data and account information,OAuth,True,no,https://smartsheet.redoc.ly/,Business
Square,"Easy way to take payments, manage refunds, and help customers checkout online",OAuth,True,unknown,https://developer.squareup.com/reference/square,Business
SwiftKanban,"Kanban software, Visualize Work, Increase Organizations Lead Time, Throughput & Productivity",apiKey,True,unknown,https://www.digite.com/knowledge-base/swiftkanban/article/api-for-swift-kanban-web-services/#restapi,Business
Tenders in Hungary,Get data for procurements in Hungary in JSON format,,True,unknown,https://tenders.guru/hu/api,Business
Tenders in Poland,Get data for procurements in Poland in JSON format,,True,unknown,https://tenders.guru/pl/api,Business
Tenders in Romania,Get data for procurements in Romania in JSON format,,True,unknown,https://tenders.guru/ro/api,Business
Tenders in Spain,Get data for procurements in Spain in JSON format,,True,unknown,https://tenders.guru/es/api,Business
Tenders in Ukraine,Get data for procurements in Ukraine in JSON format,,True,unknown,https://tenders.guru/ua/api,Business
Tomba email finder,Email Finder for B2B sales and email marketing and email verifier,apiKey,True,yes,https://tomba.io/api,Business
Trello,"Boards, lists and cards to help you organize and prioritize your projects",OAuth,True,unknown,https://developers.trello.com/,Business
Abstract Public Holidays,"Data on national, regional, and religious holidays via API",apiKey,True,yes,https://www.abstractapi.com/holidays-api,Calendar
Calendarific,Worldwide Holidays,apiKey,True,unknown,https://calendarific.com/,Calendar
Checkiday - National Holiday API,"Industry-leading Holiday API. Over 5,000 holidays and thousands of descriptions. Trusted by the World’s leading companies",apiKey,True,unknown,https://apilayer.com/marketplace/checkiday-api,Calendar
Church Calendar,Catholic liturgical calendar,,False,unknown,http://calapi.inadiutorium.cz/,Calendar
Czech Namedays Calendar,Lookup for a name and returns nameday date,,False,unknown,https://svatky.adresa.info,Calendar
Festivo Public Holidays,Fastest and most advanced public holiday and observance service on the market,apiKey,True,yes,https://docs.getfestivo.com/docs/products/public-holidays-api/intro,Calendar
Google Calendar,"Display, create and modify Google calendar events",OAuth,True,unknown,https://developers.google.com/google-apps/calendar/,Calendar
Hebrew Calendar,"Convert between Gregorian and Hebrew, fetch Shabbat and Holiday times, etc",,False,unknown,https://www.hebcal.com/home/developer-apis,Calendar
Holidays,Historical data regarding holidays,apiKey,True,unknown,https://holidayapi.com/,Calendar
LectServe,Protestant liturgical calendar,,False,unknown,http://www.lectserve.com,Calendar
Nager.Date,Public holidays for more than 90 countries,,True,no,https://date.nager.at,Calendar
Namedays Calendar,Provides namedays for multiple countries,,True,yes,https://nameday.abalin.net,Calendar
Non-Working Days,Database of ICS files for non working days,,True,unknown,https://github.com/gadael/icsdb,Calendar
Non-Working Days,"Simple REST API for checking working, non-working or short days for Russia, CIS, USA and other",,True,yes,https://isdayoff.ru,Calendar
Russian Calendar,Check if a date is a Russian holiday or not,,True,no,https://github.com/egno/work-calendar,Calendar
UK Bank Holidays,"Bank holidays in England and Wales, Scotland and Northern Ireland",,True,unknown,https://www.gov.uk/bank-holidays.json,Calendar
AnonFiles,Upload and share your files anonymously,,True,unknown,https://anonfiles.com/docs/api,Cloud Storage & File Sharing
BayFiles,Upload and share your files,,True,unknown,https://bayfiles.com/docs/api,Cloud Storage & File Sharing
Box,File Sharing and Storage,OAuth,True,unknown,https://developer.box.com/,Cloud Storage & File Sharing
ddownload,File Sharing and Storage,apiKey,True,unknown,https://ddownload.com/api,Cloud Storage & File Sharing
Dropbox,File Sharing and Storage,OAuth,True,unknown,https://www.dropbox.com/developers,Cloud Storage & File Sharing
File.io,"Super simple file sharing, convenient, anonymous and secure",,True,unknown,https://www.file.io,Cloud Storage & File Sharing
Filestack,Filestack File Uploader & File Upload API,apiKey,True,unknown,https://www.filestack.com,Cloud Storage & File Sharing
GoFile,Unlimited size file uploads for free,apiKey,True,unknown,https://gofile.io/api,Cloud Storage & File Sharing
Google Drive,File Sharing and Storage,OAuth,True,unknown,https://developers.google.com/drive/,Cloud Storage & File Sharing
Gyazo,Save & Share screen captures instantly,apiKey,True,unknown,https://gyazo.com/api/docs,Cloud Storage & File Sharing
Imgbb,Simple and quick private image sharing,apiKey,True,unknown,https://api.imgbb.com/,Cloud Storage & File Sharing
OneDrive,File Sharing and Storage,OAuth,True,unknown,https://developer.microsoft.com/onedrive,Cloud Storage & File Sharing
Pantry,Free JSON storage for small projects,,True,yes,https://getpantry.cloud/,Cloud Storage & File Sharing
Pastebin,Plain Text Storage,apiKey,True,unknown,https://pastebin.com/doc_api,Cloud Storage & File Sharing
Pinata,IPFS Pinning Services API,apiKey,True,unknown,https://docs.pinata.cloud/,Cloud Storage & File Sharing
Quip,File Sharing and Storage for groups,apiKey,True,yes,https://quip.com/dev/automation/documentation,Cloud Storage & File Sharing
Storj,Decentralized Open-Source Cloud Storage,apiKey,True,unknown,https://docs.storj.io/dcs/,Cloud Storage & File Sharing
The Null Pointer,No-bullshit file hosting and URL shortening service,,True,unknown,https://0x0.st,Cloud Storage & File Sharing
Web3 Storage,File Sharing and Storage for Free with 1TB Space,apiKey,True,yes,https://web3.storage/,Cloud Storage & File Sharing
Azure DevOps Health,Resource health helps you diagnose and get support when an Azure issue impacts your resources,apiKey,False,no,https://docs.microsoft.com/en-us/rest/api/resourcehealth,Continuous Integration
Bitrise,Build tool and processes integrations to create efficient development pipelines,apiKey,True,unknown,https://api-docs.bitrise.io/,Continuous Integration
Buddy,The fastest continuous integration and continuous delivery platform,OAuth,True,unknown,https://buddy.works/docs/api/getting-started/overview,Continuous Integration
CircleCI,Automate the software development process using continuous integration and continuous delivery,apiKey,True,unknown,https://circleci.com/docs/api/v1-reference/,Continuous Integration
Codeship,Codeship is a Continuous Integration Platform in the cloud,apiKey,True,unknown,https://docs.cloudbees.com/docs/cloudbees-codeship/latest/api-overview/,Continuous Integration
Travis CI,Sync your GitHub projects with Travis CI to test your code in minutes,apiKey,True,unknown,https://docs.travis-ci.com/api/,Continuous Integration
0x,API for querying token and pool stats across various liquidity pools,,True,yes,https://0x.org/api,Cryptocurrency
1inch,API for querying decentralize exchange,,True,unknown,https://1inch.io/api/,Cryptocurrency
Alchemy Ethereum,Ethereum Node-as-a-Service Provider,apiKey,True,yes,https://docs.alchemy.com/alchemy/,Cryptocurrency
apilayer coinlayer,Real-time Crypto Currency Exchange Rates,apiKey,True,unknown,https://coinlayer.com,Cryptocurrency
Binance,Exchange for Trading Cryptocurrencies based in China,apiKey,True,unknown,https://github.com/binance/binance-spot-api-docs,Cryptocurrency
Bitcambio,Get the list of all traded assets in the exchange,,True,unknown,https://nova.bitcambio.com.br/api/v3/docs#a-public,Cryptocurrency
BitcoinAverage,Digital Asset Price Data for the blockchain industry,apiKey,True,unknown,https://apiv2.bitcoinaverage.com/,Cryptocurrency
BitcoinCharts,Financial and Technical Data related to the Bitcoin Network,,True,unknown,https://bitcoincharts.com/about/exchanges/,Cryptocurrency
Bitfinex,Cryptocurrency Trading Platform,apiKey,True,unknown,https://docs.bitfinex.com/docs,Cryptocurrency
Bitmex,Real-Time Cryptocurrency derivatives trading platform based in Hong Kong,apiKey,True,unknown,https://www.bitmex.com/app/apiOverview,Cryptocurrency
Bittrex,Next Generation Crypto Trading Platform,apiKey,True,unknown,https://bittrex.github.io/api/v3,Cryptocurrency
Block,"Bitcoin Payment, Wallet & Transaction Data",apiKey,True,unknown,https://block.io/docs/basic,Cryptocurrency
Blockchain,"Bitcoin Payment, Wallet & Transaction Data",apiKey,True,unknown,https://www.blockchain.com/api,Cryptocurrency
blockfrost Cardano,Interaction with the Cardano mainnet and several testnets,apiKey,True,unknown,https://blockfrost.io/,Cryptocurrency
Brave NewCoin,Real-time and historic crypto data from more than 200+ exchanges,apiKey,True,unknown,https://bravenewcoin.com/developers,Cryptocurrency
BtcTurk,"Real-time cryptocurrency data, graphs and API that allows buy&sell",apiKey,True,yes,https://docs.btcturk.com/,Cryptocurrency
Bybit,Cryptocurrency data feed and algorithmic trading,apiKey,True,unknown,https://bybit-exchange.github.io/docs/linear/#t-introduction,Cryptocurrency
CoinAPI,All Currency Exchanges integrate under a single api,apiKey,True,no,https://docs.coinapi.io/,Cryptocurrency
Coinbase,"Bitcoin, Bitcoin Cash, Litecoin and Ethereum Prices",apiKey,True,unknown,https://developers.coinbase.com,Cryptocurrency
Coinbase Pro,Cryptocurrency Trading Platform,apiKey,True,unknown,https://docs.pro.coinbase.com/#api,Cryptocurrency
CoinCap,Real time Cryptocurrency prices through a RESTful API,,True,unknown,https://docs.coincap.io/,Cryptocurrency
CoinDCX,Cryptocurrency Trading Platform,apiKey,True,unknown,https://docs.coindcx.com/,Cryptocurrency
CoinDesk,CoinDesk's Bitcoin Price Index (BPI) in multiple currencies,,True,unknown,https://old.coindesk.com/coindesk-api/,Cryptocurrency
CoinGecko,"Cryptocurrency Price, Market, and Developer/Social Data",,True,yes,http://www.coingecko.com/api,Cryptocurrency
Coinigy,Interacting with Coinigy Accounts and Exchange Directly,apiKey,True,unknown,https://coinigy.docs.apiary.io,Cryptocurrency
Coinlib,Crypto Currency Prices,apiKey,True,unknown,https://coinlib.io/apidocs,Cryptocurrency
Coinlore,"Cryptocurrencies prices, volume and more",,True,unknown,https://www.coinlore.com/cryptocurrency-data-api,Cryptocurrency
CoinMarketCap,Cryptocurrencies Prices,apiKey,True,unknown,https://coinmarketcap.com/api/,Cryptocurrency
Coinpaprika,"Cryptocurrencies prices, volume and more",,True,yes,https://api.coinpaprika.com,Cryptocurrency
CoinRanking,Live Cryptocurrency data,apiKey,True,unknown,https://developers.coinranking.com/api/documentation,Cryptocurrency
Coinremitter,Cryptocurrencies Payment & Prices,apiKey,True,unknown,https://coinremitter.com/docs,Cryptocurrency
CoinStats,Crypto Tracker,,True,unknown,https://documenter.getpostman.com/view/5734027/RzZ6Hzr3?version=latest,Cryptocurrency
