API,Description,Auth,HTTPS,Cors,Link,Category
Notion,Integrate with Notion,OAuth,True,unknown,https://developers.notion.com/docs/getting-started,Documents & Productivity
PandaDoc,DocGen and eSignatures API,apiKey,True,no,https://developers.pandadoc.com,Documents & Productivity
Pocket,Bookmarking service,OAuth,True,unknown,https://getpocket.com/developer/,Documents & Productivity
Podio,File sharing and productivity,OAuth,True,unknown,https://developers.podio.com,Documents & Productivity
PrexView,"Data from XML or JSON to PDF, HTML or Image",apiKey,True,unknown,https://prexview.com,Documents & Productivity
Restpack,"Provides screenshot, HTML to PDF and content extraction APIs",apiKey,True,unknown,https://restpack.io/,Documents & Productivity
Todoist,Todo Lists,OAuth,True,unknown,https://developer.todoist.com,Documents & Productivity
Smart Image Enhancement API,Performs image upscaling by adding detail to images through multiple super-resolution algorithms,apiKey,True,unknown,https://apilayer.com/marketplace/image_enhancement-api,Documents & Productivity
Vector Express v2.0,Free vector file converting API,,True,no,https://vector.express,Documents & Productivity
WakaTime,Automated time tracking leaderboards for programmers,,True,unknown,https://wakatime.com/developers,Documents & Productivity
Zube,Full stack project management,OAuth,True,unknown,https://zube.io/docs/api,Documents & Productivity
Abstract Email Validation,Validate email addresses for deliverability and spam,apiKey,True,yes,https://www.abstractapi.com/email-verification-validation-api,Email
apilayer mailboxlayer,Email address validation,apiKey,True,unknown,https://mailboxlayer.com,Email
Cloudmersive Validate,"Validate email addresses, phone numbers, VAT numbers and domain names",apiKey,True,yes,https://cloudmersive.com/validate-api,Email
Disify,Validate and detect disposable and temporary email addresses,,True,yes,https://www.disify.com/,Email
DropMail,GraphQL API for creating and managing ephemeral e-mail inboxes,,True,unknown,https://dropmail.me/api/#live-demo,Email
EVA,Validate email addresses,,True,yes,https://eva.pingutil.com/,Email
Guerrilla Mail,Disposable temporary Email addresses,,True,unknown,https://www.guerrillamail.com/GuerrillaMailAPI.html,Email
ImprovMX,API for free email forwarding service,apiKey,True,unknown,https://improvmx.com/api,Email
Kickbox,Email verification API,,True,yes,https://open.kickbox.com/,Email
mail.gw,10 Minute Mail,,True,yes,https://docs.mail.gw,Email
mail.tm,Temporary Email Service,,True,yes,https://docs.mail.tm,Email
MailboxValidator,Validate email address to improve deliverability,apiKey,True,unknown,https://www.mailboxvalidator.com/api-email-free,Email
MailCheck.ai,Prevent users to sign up with temporary email addresses,,True,unknown,https://www.mailcheck.ai/#documentation,Email
Mailtrap,A service for the safe testing of emails sent from the development and staging environments,apiKey,True,unknown,https://mailtrap.docs.apiary.io/#,Email
Sendgrid,A cloud-based SMTP provider that allows you to send emails without having to maintain email servers,apiKey,True,unknown,https://docs.sendgrid.com/api-reference/,Email
Sendinblue,A service that provides solutions relating to marketing and/or transactional email and/or SMS,apiKey,True,unknown,https://developers.sendinblue.com/docs,Email
Verifier,Verifies that a given email is real,apiKey,True,yes,https://verifier.meetchopra.com/docs#/,Email
chucknorris.io,JSON API for hand curated Chuck Norris jokes,,True,unknown,https://api.chucknorris.io,Entertainment
Corporate Buzz Words,REST API for Corporate Buzz Words,,True,yes,https://github.com/sameerkumar18/corporate-bs-generator-api,Entertainment
Excuser,Get random excuses for various situations,,True,unknown,https://excuser.herokuapp.com/,Entertainment
Fun Fact,A simple HTTPS api that can randomly select and return a fact from the FFA database,,True,yes,https://api.aakhilv.me,Entertainment
Imgflip,Gets an array of popular memes,,True,unknown,https://imgflip.com/api,Entertainment
Meme Maker,REST API for create your own meme,,True,unknown,https://mememaker.github.io/API/,Entertainment
NaMoMemes,Memes on Narendra Modi,,True,unknown,https://github.com/theIYD/NaMoMemes,Entertainment
Random Useless Facts,"Get useless, but true facts",,True,unknown,https://uselessfacts.jsph.pl/,Entertainment
Techy,JSON and Plaintext API for tech-savvy sounding phrases,,True,unknown,https://techy-api.vercel.app/,Entertainment
Yo Momma Jokes,REST API for Yo Momma Jokes,,True,unknown,https://github.com/beanboi7/yomomma-apiv2,Entertainment
BreezoMeter Pollen,Daily Forecast pollen conditions data for a specific location,apiKey,True,unknown,https://docs.breezometer.com/api-documentation/pollen-api/v2/,Environment
Carbon Interface,API to calculate carbon (C02) emissions estimates for common C02 emitting activities,apiKey,True,yes,https://docs.carboninterface.com/,Environment
Climatiq,Calculate the environmental footprint created by a broad range of emission-generating activities,apiKey,True,yes,https://docs.climatiq.io,Environment
Cloverly,API calculates the impact of common carbon-intensive activities in real time,apiKey,True,unknown,https://www.cloverly.com/carbon-offset-documentation,Environment
CO2 Offset,API calculates and validates the carbon footprint,,True,unknown,https://co2offset.io/api.html,Environment
Danish data service Energi,Open energy data from Energinet to society,,True,unknown,https://www.energidataservice.dk/,Environment
GrünstromIndex,Green Power Index for Germany (Grünstromindex/GSI),,False,yes,https://gruenstromindex.de/,Environment
IQAir,Air quality and weather data,apiKey,True,unknown,https://www.iqair.com/air-pollution-data-api,Environment
Luchtmeetnet,Predicted and actual air quality components for The Netherlands (RIVM),,True,unknown,https://api-docs.luchtmeetnet.nl/,Environment
National Grid ESO,Open data from Great Britain’s Electricity System Operator,,True,unknown,https://data.nationalgrideso.com/,Environment
OpenAQ,Open air quality data,apiKey,True,unknown,https://docs.openaq.org/,Environment
PM2.5 Open Data Portal,Open low-cost PM2.5 sensor data,,True,unknown,https://pm25.lass-net.org/#apis,Environment
PM25.in,Air quality of China,apiKey,False,unknown,http://www.pm25.in/api_doc,Environment
PVWatts,Energy production photovoltaic (PV) energy systems,apiKey,True,unknown,https://developer.nrel.gov/docs/solar/pvwatts/v6/,Environment
Srp Energy,Hourly usage energy report for Srp customers,apiKey,True,no,https://srpenergy-api-client-python.readthedocs.io/en/latest/api.html,Environment
UK Carbon Intensity,The Official Carbon Intensity API for Great Britain developed by National Grid,,True,unknown,https://carbon-intensity.github.io/api-definitions/#carbon-intensity-api-v1-0-0,Environment
Website Carbon,API to estimate the carbon footprint of loading web pages,,True,unknown,https://api.websitecarbon.com/,Environment
Eventbrite,Find events,OAuth,True,unknown,https://www.eventbrite.com/platform/api/,Events
SeatGeek,"Search events, venues and performers",apiKey,True,unknown,https://platform.seatgeek.com/,Events
Ticketmaster,"Search events, attractions, or venues",apiKey,True,unknown,http://developer.ticketmaster.com/products-and-docs/apis/getting-started/,Events
Abstract VAT Validation,Validate VAT numbers and calculate VAT rates,apiKey,True,yes,https://www.abstractapi.com/vat-validation-rates-api,Finance
Aletheia,"Insider trading data, earnings call analysis, financial statements, and more",apiKey,True,yes,https://aletheiaapi.com/,Finance
Alpaca,Realtime and historical market data on all US equities and ETFs,apiKey,True,yes,https://alpaca.markets/docs/api-documentation/api-v2/market-data/alpaca-data-api-v2/,Finance
Alpha Vantage,Realtime and historical stock data,apiKey,True,unknown,https://www.alphavantage.co/,Finance
apilayer marketstack,"Real-Time, Intraday & Historical Market Data API",apiKey,True,unknown,https://marketstack.com/,Finance
Banco do Brasil,All Banco do Brasil financial transaction APIs,OAuth,True,yes,https://developers.bb.com.br/home,Finance
Bank Data API,Instant IBAN and SWIFT number validation across the globe,apiKey,True,unknown,https://apilayer.com/marketplace/bank_data-api,Finance
Billplz,Payment platform,apiKey,True,unknown,https://www.billplz.com/api,Finance
Binlist,Public access to a database of IIN/BIN information,,True,unknown,https://binlist.net/,Finance
Boleto.Cloud,A api to generate boletos in Brazil,apiKey,True,unknown,https://boleto.cloud/,Finance
Citi,All Citigroup account and statement data APIs,apiKey,True,unknown,https://sandbox.developerhub.citi.com/api-catalog-list,Finance
Econdb,Global macroeconomic data,,True,yes,https://www.econdb.com/api/,Finance
Fed Treasury,U.S. Department of the Treasury Data,,True,unknown,https://fiscaldata.treasury.gov/api-documentation/,Finance
Finage,"Finage is a stock, currency, cryptocurrency, indices, and ETFs real-time & historical data provider",apiKey,True,unknown,https://finage.co.uk,Finance
Financial Modeling Prep,Realtime and historical stock data,apiKey,True,unknown,https://site.financialmodelingprep.com/developer/docs,Finance
Finnhub,"Real-Time RESTful APIs and Websocket for Stocks, Currencies, and Crypto",apiKey,True,unknown,https://finnhub.io/docs/api,Finance
FRED,Economic data from the Federal Reserve Bank of St. Louis,apiKey,True,yes,https://fred.stlouisfed.org/docs/api/fred/,Finance
Front Accounting APIs,Front accounting is multilingual and multicurrency software for small businesses,OAuth,True,yes,https://frontaccounting.com/fawiki/index.php?n=Devel.SimpleAPIModule,Finance
Hotstoks,Stock market data powered by SQL,apiKey,True,yes,https://hotstoks.com?utm_source=public-apis,Finance
IEX Cloud,Realtime & Historical Stock and Market Data,apiKey,True,yes,https://iexcloud.io/docs/api/,Finance
IG,Spreadbetting and CFD Market Data,apiKey,True,unknown,https://labs.ig.com/gettingstarted,Finance
Indian Mutual Fund,Get complete history of India Mutual Funds Data,,True,unknown,https://www.mfapi.in/,Finance
Intrinio,A wide selection of financial data feeds,apiKey,True,unknown,https://intrinio.com/,Finance
Klarna,Klarna payment and shopping service,apiKey,True,unknown,https://docs.klarna.com/klarna-payments/api/payments-api/,Finance
MercadoPago,Mercado Pago API reference - all the information you need to develop your integrations,apiKey,True,unknown,https://www.mercadopago.com.br/developers/es/reference,Finance
Mono,Connect with users’ bank accounts and access transaction data in Africa,apiKey,True,unknown,https://mono.co/,Finance
Moov,"The Moov API makes it simple for platforms to send, receive, and store money",apiKey,True,unknown,https://docs.moov.io/api/,Finance
Nordigen,Connect to bank accounts using official bank APIs and get raw transaction data,apiKey,True,unknown,https://nordigen.com/en/account_information_documenation/integration/quickstart_guide/,Finance
OpenFIGI,"Equity, index, futures, options symbology from Bloomberg LP",apiKey,True,yes,https://www.openfigi.com/api,Finance
Plaid,Connect with user's bank accounts and access transaction data,apiKey,True,unknown,https://plaid.com/,Finance
Polygon,Historical stock market data,apiKey,True,unknown,https://polygon.io/,Finance
Portfolio Optimizer,Portfolio analysis and optimization,,True,yes,https://portfoliooptimizer.io/,Finance
Razorpay IFSC,Indian Financial Systems Code (Bank Branch Codes),,True,unknown,https://razorpay.com/docs/,Finance
Real Time Finance,Websocket API to access realtime stock data,apiKey,False,unknown,https://github.com/Real-time-finance/finance-websocket-API/,Finance
SEC EDGAR Data,API to access annual reports of public US companies,,True,yes,https://www.sec.gov/edgar/sec-api-documentation,Finance
SmartAPI,Gain access to set of <SmartAPI> and create end-to-end broking services,apiKey,True,unknown,https://smartapi.angelbroking.com/,Finance
StockData,"Real-Time, Intraday & Historical Market Data, News and Sentiment API",apiKey,True,yes,https://www.StockData.org,Finance
Styvio,Realtime and historical stock data and current stock sentiment,apiKey,True,unknown,https://www.Styvio.com,Finance
Tax Data API,Instant VAT number and tax validation across the globe,apiKey,True,unkown,https://apilayer.com/marketplace/tax_data-api,Finance
Tradier,"US equity/option market data (delayed, intraday, historical)",OAuth,True,yes,https://developer.tradier.com,Finance
Twelve Data,Stock market data (real-time & historical),apiKey,True,unknown,https://twelvedata.com/,Finance
WallstreetBets,WallstreetBets Stock Comments Sentiment Analysis,,True,unknown,https://dashboard.nbshare.io/apps/reddit/api/,Finance
Yahoo Finance,"Real time low latency Yahoo Finance API for stock market, crypto currencies, and currency exchange",apiKey,True,yes,https://www.yahoofinanceapi.com/,Finance
YNAB,Budgeting & Planning,OAuth,True,yes,https://api.youneedabudget.com/,Finance
Zoho Books,"Online accounting software, built for your business",OAuth,True,unknown,https://www.zoho.com/books/api/v3/,Finance
BaconMockup,Resizable bacon placeholder images,,True,yes,https://baconmockup.com/,Food & Drink
Chomp,Data about various grocery products and foods,apiKey,True,unknown,https://chompthis.com/api/,Food & Drink
Coffee,Random pictures of coffee,,True,unknown,https://coffee.alexflipnote.dev/,Food & Drink
Edamam nutrition,Nutrition Analysis,apiKey,True,unknown,https://developer.edamam.com/edamam-docs-nutrition-api,Food & Drink
Edamam recipes,Recipe Search,apiKey,True,unknown,https://developer.edamam.com/edamam-docs-recipe-api,Food & Drink
Foodish,Random pictures of food dishes,,True,yes,https://github.com/surhud004/Foodish#readme,Food & Drink
Fruityvice,Data about all kinds of fruit,,True,unknown,https://www.fruityvice.com,Food & Drink
Kroger,Supermarket Data,apiKey,True,unknown,https://developer.kroger.com/reference,Food & Drink
LCBO,Alcohol,apiKey,True,unknown,https://lcboapi.com/,Food & Drink
Open Brewery DB,"Breweries, Cideries and Craft Beer Bottle Shops",,True,yes,https://www.openbrewerydb.org,Food & Drink
Open Food Facts,Food Products Database,,True,unknown,https://world.openfoodfacts.org/data,Food & Drink
PunkAPI,Brewdog Beer Recipes,,True,unknown,https://punkapi.com/,Food & Drink
Rustybeer,Beer brewing tools,,True,no,https://rustybeer.herokuapp.com/,Food & Drink
Spoonacular,"Recipes, Food Products, and Meal Planning",apiKey,True,unknown,https://spoonacular.com/food-api,Food & Drink
Systembolaget,Govornment owned liqour store in Sweden,apiKey,True,unknown,https://api-portal.systembolaget.se,Food & Drink
TacoFancy,Community-driven taco database,,False,unknown,https://github.com/evz/tacofancy-api,Food & Drink
Tasty,"API to query data about recipe, plan, ingredients",apiKey,True,unknown,https://rapidapi.com/apidojo/api/tasty/,Food & Drink
The Report of the Week,Food & Drink Reviews,,True,unknown,https://github.com/andyklimczak/TheReportOfTheWeek-API,Food & Drink
TheCocktailDB,Cocktail Recipes,apiKey,True,yes,https://www.thecocktaildb.com/api.php,Food & Drink
TheMealDB,Meal Recipes,apiKey,True,yes,https://www.themealdb.com/api.php,Food & Drink
Untappd,Social beer sharing,OAuth,True,unknown,https://untappd.com/api/docs,Food & Drink
What's on the menu?,NYPL human-transcribed historical menu collection,apiKey,False,unknown,http://nypl.github.io/menus-api/,Food & Drink
WhiskyHunter,Past online whisky auctions statistical data,,True,unknown,https://whiskyhunter.net/api/,Food & Drink
Zestful,Parse recipe ingredients,apiKey,True,yes,https://zestfuldata.com/,Food & Drink
Age of Empires II,Get information about Age of Empires II resources,,True,no,https://age-of-empires-2-api.herokuapp.com,Games & Comics
AmiiboAPI,Nintendo Amiibo Information,,True,yes,https://amiiboapi.com/,Games & Comics
Animal Crossing: New Horizons,"API for critters, fossils, art, music, furniture and villagers",,True,unknown,http://acnhapi.com/,Games & Comics
Autochess VNG,Rest Api for Autochess VNG,,True,yes,https://github.com/didadadida93/autochess-vng-api,Games & Comics
Barter.VG,"Provides information about Game, DLC, Bundles, Giveaways, Trading",,True,yes,https://github.com/bartervg/barter.vg/wiki,Games & Comics
Battle.net,"Diablo III, Hearthstone, StarCraft II and World of Warcraft game data APIs",OAuth,True,yes,https://develop.battle.net/documentation/guides/getting-started,Games & Comics
Board Game Geek,"Board games, RPG and videogames",,True,no,https://boardgamegeek.com/wiki/page/BGG_XML_API2,Games & Comics
Brawl Stars,Brawl Stars Game Information,apiKey,True,unknown,https://developer.brawlstars.com,Games & Comics
Bugsnax,Get information about Bugsnax,,True,yes,https://www.bugsnaxapi.com/,Games & Comics
CheapShark,Steam/PC Game Prices and Deals,,True,yes,https://www.cheapshark.com/api,Games & Comics
Chess.com,Chess.com read-only REST API,,True,unknown,https://www.chess.com/news/view/published-data-api,Games & Comics
Chuck Norris Database,Jokes,,False,unknown,http://www.icndb.com/api/,Games & Comics
Clash of Clans,Clash of Clans Game Information,apiKey,True,unknown,https://developer.clashofclans.com,Games & Comics
Clash Royale,Clash Royale Game Information,apiKey,True,unknown,https://developer.clashroyale.com,Games & Comics
Comic Vine,Comics,,True,unknown,https://comicvine.gamespot.com/api/documentation,Games & Comics
Crafatar,API for Minecraft skins and faces,,True,yes,https://crafatar.com,Games & Comics
Cross Universe,Cross Universe Card Data,,True,yes,https://crossuniverse.psychpsyo.com/apiDocs.html,Games & Comics
Deck of Cards,Deck of Cards,,False,unknown,http://deckofcardsapi.com/,Games & Comics
Destiny The Game,Bungie Platform API,apiKey,True,unknown,https://bungie-net.github.io/multi/index.html,Games & Comics
Digimon Information,Provides information about digimon creatures,,True,unknown,https://digimon-api.vercel.app/,Games & Comics
Digimon TCG,Search for Digimon cards in digimoncard.io,,True,unknown,https://documenter.getpostman.com/view/14059948/TzecB4fH,Games & Comics
Disney,Information of Disney characters,,True,yes,https://disneyapi.dev,Games & Comics
Dota 2,"Provides information about Player stats , Match stats, Rankings for Dota 2",apiKey,True,unknown,https://docs.opendota.com/,Games & Comics
Dungeons and Dragons,"Reference for 5th edition spells, classes, monsters, and more",,False,no,https://www.dnd5eapi.co/docs/,Games & Comics
Dungeons and Dragons (Alternate),Includes all monsters and spells from the SRD (System Reference Document) as well as a search API,,True,yes,https://open5e.com/,Games & Comics
Eve Online,Third-Party Developer Documentation,OAuth,True,unknown,https://esi.evetech.net/ui,Games & Comics
FFXIV Collect,Final Fantasy XIV data on collectables,,True,yes,https://ffxivcollect.com/,Games & Comics
FIFA Ultimate Team,FIFA Ultimate Team items API,,True,unknown,https://www.easports.com/fifa/ultimate-team/api/fut/item,Games & Comics
Final Fantasy XIV,Final Fantasy XIV Game data API,,True,yes,https://xivapi.com/,Games & Comics
Fortnite,Fortnite Stats,apiKey,True,unknown,https://fortnitetracker.com/site-api,Games & Comics
Forza,Show random image of car from Forza,,True,unknown,https://docs.forza-api.tk,Games & Comics
FreeToGame,Free-To-Play Games Database,,True,yes,https://www.freetogame.com/api-doc,Games & Comics
Fun Facts,Random Fun Facts,,True,yes,https://asli-fun-fact-api.herokuapp.com/,Games & Comics
FunTranslations,Translate Text into funny languages,,True,yes,https://api.funtranslations.com/,Games & Comics
GamerPower,Game Giveaways Tracker,,True,yes,https://www.gamerpower.com/api-read,Games & Comics
GDBrowser,Easy way to use the Geometry Dash Servers,,True,unknown,https://gdbrowser.com/api,Games & Comics
Geek-Jokes,Fetch a random geeky/programming related joke for use in all sorts of applications,,True,yes,https://github.com/sameerkumar18/geek-joke-api,Games & Comics
Genshin Impact,Genshin Impact game data,,True,yes,https://genshin.dev,Games & Comics
Giant Bomb,Video Games,apiKey,True,unknown,https://www.giantbomb.com/api/documentation,Games & Comics
GraphQL Pokemon,GraphQL powered Pokemon API. Supports generations 1 through 8,,True,yes,https://github.com/favware/graphql-pokemon,Games & Comics
Guild Wars 2,Guild Wars 2 Game Information,apiKey,True,unknown,https://wiki.guildwars2.com/wiki/API:Main,Games & Comics
GW2Spidy,"GW2Spidy API, Items data on the Guild Wars 2 Trade Market",,True,unknown,https://github.com/rubensayshi/gw2spidy/wiki,Games & Comics
Halo,Halo 5 and Halo Wars 2 Information,apiKey,True,unknown,https://developer.haloapi.com/,Games & Comics
Hearthstone,Hearthstone Cards Information,X-Mashape-Key,True,unknown,http://hearthstoneapi.com/,Games & Comics
Humble Bundle,Humble Bundle's current bundles,apiKey,True,unknown,https://rapidapi.com/Ziggoto/api/humble-bundle,Games & Comics
Humor,"Humor, Jokes, and Memes",apiKey,True,unknown,https://humorapi.com,Games & Comics
Hypixel,Hypixel player stats,apiKey,True,unknown,https://api.hypixel.net/,Games & Comics
Hyrule Compendium,Data on all interactive items from The Legend of Zelda: BOTW,,True,unknown,https://github.com/gadhagod/Hyrule-Compendium-API,Games & Comics
Hytale,Hytale blog posts and jobs,,True,unknown,https://hytale-api.com/,Games & Comics
IGDB.com,Video Game Database,apiKey,True,unknown,https://api-docs.igdb.com,Games & Comics
JokeAPI,"Programming, Miscellaneous and Dark Jokes",,True,yes,https://sv443.net/jokeapi/v2/,Games & Comics
Jokes One,Joke of the day and large category of jokes accessible via REST API,apiKey,True,yes,https://jokes.one/api/joke/,Games & Comics
Jservice,Jeopardy Question Database,,False,unknown,http://jservice.io,Games & Comics
Lichess,"Access to all data of users, games, puzzles and etc on Lichess",OAuth,True,unknown,https://lichess.org/api,Games & Comics
Magic The Gathering,Magic The Gathering Game Information,,False,unknown,http://magicthegathering.io/,Games & Comics
Mario Kart Tour,"API for Drivers, Karts, Gliders and Courses",OAuth,True,unknown,https://mario-kart-tour-api.herokuapp.com/,Games & Comics
Marvel,Marvel Comics,apiKey,True,unknown,https://developer.marvel.com,Games & Comics
Minecraft Server Status,API to get Information about a Minecraft Server,,True,no,https://api.mcsrvstat.us,Games & Comics
MMO Games,"MMO Games Database, News and Giveaways",,True,no,https://www.mmobomb.com/api,Games & Comics
mod.io,Cross Platform Mod API,apiKey,True,unknown,https://docs.mod.io,Games & Comics
Mojang,Mojang / Minecraft API,apiKey,True,unknown,https://wiki.vg/Mojang_API,Games & Comics
Monster Hunter World,Monster Hunter World data,,True,yes,https://docs.mhw-db.com/,Games & Comics
Open Trivia,Trivia Questions,,True,unknown,https://opentdb.com/api_config.php,Games & Comics
PandaScore,E-sports games and results,apiKey,True,unknown,https://developers.pandascore.co/,Games & Comics
Path of Exile,Path of Exile Game Information,OAuth,True,unknown,https://www.pathofexile.com/developer/docs,Games & Comics
PlayerDB,"Query Minecraft, Steam and XBox Accounts",,True,unknown,https://playerdb.co/,Games & Comics
Pokéapi,Pokémon Information,,True,unknown,https://pokeapi.co,Games & Comics
PokéAPI (GraphQL),The Unofficial GraphQL for PokeAPI,,True,yes,https://github.com/mazipan/graphql-pokeapi,Games & Comics
Pokémon TCG,Pokémon TCG Information,,True,unknown,https://pokemontcg.io,Games & Comics
Psychonauts,Psychonauts World Characters Information and PSI Powers,,True,yes,https://psychonauts-api.netlify.app/,Games & Comics
PUBG,Access in-game PUBG data,apiKey,True,yes,https://developer.pubg.com/,Games & Comics
Puyo Nexus,Puyo Puyo information from Puyo Nexus Wiki,,True,yes,https://github.com/deltadex7/puyodb-api-deno,Games & Comics
quizapi.io,Access to various kind of quiz questions,apiKey,True,yes,https://quizapi.io/,Games & Comics
Raider,Provides detailed character and guild rankings for Raiding and Mythic+ content in World of Warcraft,,True,unknown,https://raider.io/api,Games & Comics
RAWG.io,"500,000+ games for 50 platforms including mobiles",apiKey,True,unknown,https://rawg.io/apidocs,Games & Comics
Rick and Morty,"All the Rick and Morty information, including images",,True,yes,https://rickandmortyapi.com,Games & Comics
Riot Games,League of Legends Game Information,apiKey,True,unknown,https://developer.riotgames.com/,Games & Comics
RPS 101,"Rock, Paper, Scissors with 101 objects",,True,yes,https://rps101.pythonanywhere.com/api,Games & Comics
RuneScape,RuneScape and OSRS RPGs information,,True,no,https://runescape.wiki/w/Application_programming_interface,Games & Comics
Sakura CardCaptor,Sakura CardCaptor Cards Information,,True,unknown,https://github.com/JessVel/sakura-card-captor-api,Games & Comics
Scryfall,Magic: The Gathering database,,True,yes,https://scryfall.com/docs/api,Games & Comics
SpaceTradersAPI,A playable inter-galactic space trading MMOAPI,OAuth,True,yes,https://spacetraders.io?rel=pub-apis,Games & Comics
Steam,Steam Web API documentation,apiKey,True,no,https://steamapi.xpaw.me/,Games & Comics
Steam,Internal Steam Web API documentation,,True,no,https://github.com/Revadike/InternalSteamWebAPI/wiki,Games & Comics
SuperHeroes,All SuperHeroes and Villains data from all universes under a single API,apiKey,True,unknown,https://superheroapi.com,Games & Comics
TCGdex,Multi languages Pokémon TCG Information,,True,yes,https://www.tcgdex.net/docs,Games & Comics
Tebex,Tebex API for information about game purchases,X-Mashape-Key,True,no,https://docs.tebex.io/plugin/,Games & Comics
TETR.IO,TETR.IO Tetra Channel API,,True,unknown,https://tetr.io/about/api/,Games & Comics
Tronald Dump,The dumbest things Donald Trump has ever said,,True,unknown,https://www.tronalddump.io/,Games & Comics
Universalis,Final Fantasy XIV market board data,,True,yes,https://universalis.app/docs/index.html,Games & Comics
Valorant (non-official),"An extensive API containing data of most Valorant in-game items, assets and more",,True,unknown,https://valorant-api.com,Games & Comics
