API,Description,Auth,HTTPS,Cors,Link,Category
Warface (non-official),Official API proxy with better data structure and more features,,True,no,https://api.wfstats.cf,Games & Comics
Wargaming.net,Wargaming.net info and stats,apiKey,True,no,https://developers.wargaming.net/,Games & Comics
When is next MCU film,Upcoming MCU film information,,True,unknown,https://github.com/DiljotSG/MCU-Countdown/blob/develop/docs/API.md,Games & Comics
xkcd,Retrieve xkcd comics as JSON,,True,no,https://xkcd.com/json.html,Games & Comics
Yu-Gi-Oh!,Yu-Gi-Oh! TCG Information,,True,unknown,https://db.ygoprodeck.com/api-guide/,Games & Comics
Abstract IP Geolocation,Geolocate website visitors from their IPs,apiKey,True,yes,https://www.abstractapi.com/ip-geolocation-api,Geocoding
Actinia Grass GIS,Actinia is an open source REST API for geographical data that uses GRASS GIS,apiKey,True,unknown,https://actinia.mundialis.de/api_docs/,Geocoding
administrative-divisons-db,Get all administrative divisions of a country,,True,yes,https://github.com/kamikazechaser/administrative-divisions-db,Geocoding
adresse.data.gouv.fr,"Address database of France, geocoding and reverse",,True,unknown,https://adresse.data.gouv.fr,Geocoding
Airtel IP,IP Geolocation API. Collecting data from multiple sources,,True,unknown,https://sys.airtel.lv/ip2country/1.1.1.1/?full=true,Geocoding
Apiip,Get location information by IP address,apiKey,True,yes,https://apiip.net/,Geocoding
apilayer ipstack,Locate and identify website visitors by IP address,apiKey,True,unknown,https://ipstack.com/,Geocoding
Battuta,A (country/region/city) in-cascade location API,apiKey,False,unknown,http://battuta.medunes.net,Geocoding
BigDataCloud,Provides fast and accurate IP geolocation APIs along with security checks and confidence area,apiKey,True,unknown,https://www.bigdatacloud.com/ip-geolocation-apis,Geocoding
Bing Maps,Create/customize digital maps based on Bing Maps data,apiKey,True,unknown,https://www.microsoft.com/maps/,Geocoding
bng2latlong,Convert British OSGB36 easting and northing (British National Grid) to WGS84 latitude and longitude,,True,yes,https://www.getthedata.com/bng2latlong,Geocoding
Cartes.io,Create maps and markers for anything,,True,unknown,https://github.com/M-Media-Group/Cartes.io/wiki/API,Geocoding
Cep.la,"Brazil RESTful API to find information about streets, zip codes, neighborhoods, cities and states",,False,unknown,http://cep.la/,Geocoding
CitySDK,Open APIs for select European cities,,True,unknown,http://www.citysdk.eu/citysdk-toolkit/,Geocoding
Country,Get your visitor's country from their IP,,True,yes,http://country.is/,Geocoding
CountryStateCity,"World countries, states, regions, provinces, cities & towns in JSON, SQL, XML, YAML, & CSV format",apiKey,True,yes,https://countrystatecity.in/,Geocoding
Ducks Unlimited,API explorer that gives a query URL with a JSON response of locations and cities,,True,no,https://gis.ducks.org/datasets/du-university-chapters/api,Geocoding
FreeGeoIP,"Free geo ip information, no registration required. 15k/hour rate limit",,True,yes,https://freegeoip.app/,Geocoding
GeoApi,French geographical data,,True,unknown,https://api.gouv.fr/api/geoapi.html,Geocoding
Geoapify,"Forward and reverse geocoding, address autocomplete",apiKey,True,yes,https://www.geoapify.com/api/geocoding-api/,Geocoding
Geocod.io,Address geocoding / reverse geocoding in bulk,apiKey,True,unknown,https://www.geocod.io/,Geocoding
Geocode.xyz,"Provides worldwide forward/reverse geocoding, batch geocoding and geoparsing",,True,unknown,https://geocode.xyz/api,Geocoding
Geocodify.com,"Worldwide geocoding, geoparsing and autocomplete for addresses",apiKey,True,yes,https://geocodify.com/,Geocoding
Geodata.gov.gr,Open geospatial data and API service for Greece,,True,unknown,https://geodata.gov.gr/en/,Geocoding
GeoDataSource,Geocoding of city name by using latitude and longitude coordinates,apiKey,True,unknown,https://www.geodatasource.com/web-service,Geocoding
GeoDB Cities,"Get global city, region, and country data",apiKey,True,unknown,http://geodb-cities-api.wirefreethought.com/,Geocoding
GeographQL,"A Country, State, and City GraphQL API",,True,yes,https://geographql.netlify.app,Geocoding
GeoJS,IP geolocation with ChatOps integration,,True,yes,https://www.geojs.io/,Geocoding
Geokeo,Geokeo geocoding service- with 2500 free api requests daily,,True,yes,https://geokeo.com,Geocoding
GeoNames,Place names and other geographical data,,False,unknown,http://www.geonames.org/export/web-services.html,Geocoding
geoPlugin,IP geolocation and currency conversion,,True,yes,https://www.geoplugin.com,Geocoding
Google Earth Engine,A cloud-based platform for planetary-scale environmental data analysis,apiKey,True,unknown,https://developers.google.com/earth-engine/,Geocoding
Google Maps,Create/customize digital maps based on Google Maps data,apiKey,True,unknown,https://developers.google.com/maps/,Geocoding
Graph Countries,"Country-related data like currencies, languages, flags, regions+subregions and bordering countries",,True,unknown,https://github.com/lennertVanSever/graphcountries,Geocoding
HelloSalut,Get hello translation following user language,,True,unknown,https://fourtonfish.com/project/hellosalut-api/,Geocoding
HERE Maps,Create/customize digital maps based on HERE Maps data,apiKey,True,unknown,https://developer.here.com,Geocoding
Hirak IP to Country,"Ip to location with country code, currency code & currency name, fast response, unlimited requests",apiKey,True,unknown,https://iplocation.hirak.site/,Geocoding
Hong Kong GeoData Store,API for accessing geo-data of Hong Kong,,True,unknown,https://geodata.gov.hk/gs/,Geocoding
IBGE,Aggregate services of IBGE (Brazilian Institute of Geography and Statistics),,True,unknown,https://servicodados.ibge.gov.br/api/docs/,Geocoding
IP 2 Country,Map an IP to a country,,True,unknown,https://ip2country.info,Geocoding
IP Address Details,Find geolocation with ip address,,True,unknown,https://ipinfo.io/,Geocoding
IP Vigilante,Free IP Geolocation API,,True,unknown,https://www.ipvigilante.com/,Geocoding
ip-api,Find location with IP address or domain,,False,unknown,https://ip-api.com/docs,Geocoding
IP2Location,IP geolocation web service to get more than 55 parameters,apiKey,True,unknown,https://www.ip2location.com/web-service/ip2location,Geocoding
IP2Proxy,Detect proxy and VPN using IP address,apiKey,True,unknown,https://www.ip2location.com/web-service/ip2proxy,Geocoding
ipapi.co,Find IP address location information,,True,yes,https://ipapi.co/api/#introduction,Geocoding
ipapi.com,Real-time Geolocation & Reverse IP Lookup REST API,apiKey,True,unknown,https://ipapi.com/,Geocoding
IPGEO,Unlimited free IP Address API with useful information,,True,unknown,https://api.techniknews.net/ipgeo/,Geocoding
ipgeolocation,IP Geolocation AP with free plan 30k requests per month,apiKey,True,yes,https://ipgeolocation.io/,Geocoding
IPInfoDB,"Free Geolocation tools and APIs for country, region, city and time zone lookup by IP address",apiKey,True,unknown,https://www.ipinfodb.com/api,Geocoding
Kakao Maps,Kakao Maps provide multiple APIs for Korean maps,apiKey,True,unknown,https://apis.map.kakao.com,Geocoding
keycdn IP Location Finder,Get the IP geolocation data through the simple REST API. All the responses are JSON encoded,apiKey,True,unknown,https://tools.keycdn.com/geo,Geocoding
LocationIQ,Provides forward/reverse geocoding and batch geocoding,apiKey,True,yes,https://locationiq.org/docs/,Geocoding
Longdo Map,Interactive map with detailed places and information portal in Thailand,apiKey,True,yes,https://map.longdo.com/docs/,Geocoding
Mapbox,Create/customize beautiful digital maps,apiKey,True,unknown,https://docs.mapbox.com/,Geocoding
MapQuest,To access tools and resources to map the world,apiKey,True,no,https://developer.mapquest.com/,Geocoding
Mexico,Mexico RESTful zip codes API,,True,unknown,https://github.com/IcaliaLabs/sepomex,Geocoding
Nominatim,Provides worldwide forward / reverse geocoding,,True,yes,https://nominatim.org/release-docs/latest/api/Overview/,Geocoding
"One Map, Singapore",Singapore Land Authority REST API services for Singapore addresses,apiKey,True,unknown,https://www.onemap.gov.sg/docs/,Geocoding
OnWater,Determine if a lat/lon is on water or land,,True,unknown,https://onwater.io/,Geocoding
Open Topo Data,Elevation and ocean depth for a latitude and longitude,,True,no,https://www.opentopodata.org,Geocoding
OpenCage,Forward and reverse geocoding using open data,apiKey,True,yes,https://opencagedata.com,Geocoding
openrouteservice.org,"Directions, POIs, isochrones, geocoding (+reverse), elevation, and more",apiKey,True,unknown,https://openrouteservice.org/,Geocoding
OpenStreetMap,"Navigation, geolocation and geographical data",OAuth,False,unknown,http://wiki.openstreetmap.org/wiki/API,Geocoding
Pinball Map,A crowdsourced map of public pinball machines,,True,yes,https://pinballmap.com/api/v1/docs,Geocoding
positionstack,Forward & Reverse Batch Geocoding REST API,apiKey,True,unknown,https://positionstack.com/,Geocoding
Postali,Mexico Zip Codes API,,True,yes,https://postali.app/api,Geocoding
PostcodeData.nl,Provide geolocation data based on postcode for Dutch addresses,,False,unknown,http://api.postcodedata.nl/v1/postcode/?postcode=1211EP&streetnumber=60&ref=domeinnaam.nl&type=json,Geocoding
Postcodes.io,Postcode lookup & Geolocation for the UK,,True,yes,https://postcodes.io,Geocoding
Queimadas INPE,Access to heat focus data (probable wildfire),,True,unknown,https://queimadas.dgi.inpe.br/queimadas/dados-abertos/,Geocoding
REST Countries,Get information about countries via a RESTful API,,True,yes,https://restcountries.com,Geocoding
RoadGoat Cities,Cities content & photos API,apiKey,True,no,https://www.roadgoat.com/business/cities-api,Geocoding
Rwanda Locations,"Rwanda Provences, Districts, Cities, Capital City, Sector, cells, villages and streets",,True,unknown,https://rapidapi.com/victorkarangwa4/api/rwanda,Geocoding
SLF,"German city, country, river, database",,True,yes,https://github.com/slftool/slftool.github.io/blob/master/API.md,Geocoding
SpotSense,Add location based interactions to your mobile app,apiKey,True,unknown,https://spotsense.io/,Geocoding
Telize,Telize offers location information from any IP address,apiKey,True,yes,https://rapidapi.com/fcambus/api/telize/,Geocoding
TomTom,"Maps, Directions, Places and Traffic APIs",apiKey,True,yes,https://developer.tomtom.com/,Geocoding
Uebermaps,Discover and share maps with friends,apiKey,True,unknown,https://uebermaps.com/api/v2,Geocoding
US ZipCode,Validate and append data for any US ZipCode,apiKey,True,yes,https://www.smarty.com/docs/cloud/us-zipcode-api,Geocoding
Utah AGRC,Utah Web API for geocoding Utah addresses,apiKey,True,unknown,https://api.mapserv.utah.gov,Geocoding
ViaCep,Brazil RESTful zip codes API,,True,unknown,https://viacep.com.br,Geocoding
What3Words,Three words as rememberable and unique coordinates worldwide,apiKey,True,unknown,https://what3words.com,Geocoding
Yandex.Maps Geocoder,Use geocoding to get an object's coordinates from its address,apiKey,True,unknown,https://yandex.com/dev/maps/geocoder,Geocoding
ZipCodeAPI,"US zip code distance, radius and location API",apiKey,True,unknown,https://www.zipcodeapi.com,Geocoding
Zippopotam.us,"Get information about place such as country, city, state, etc",,False,unknown,http://www.zippopotam.us,Geocoding
Ziptastic,"Get the country, state, and city of any US zip-code",,True,unknown,https://ziptasticapi.com/,Geocoding
Bank Negara Malaysia Open Data,Malaysia Central Bank Open Data,,True,unknown,https://apikijangportal.bnm.gov.my/,Government
BCLaws,Access to the laws of British Columbia,,False,unknown,https://www.bclaws.gov.bc.ca/civix/template/complete/api/index.html,Government
Brazil,Community driven API for Brazil Public Data,,True,yes,https://brasilapi.com.br/,Government
Brazil Central Bank Open Data,Brazil Central Bank Open Data,,True,unknown,https://dadosabertos.bcb.gov.br/,Government
Brazil Receita WS,Consult companies by CNPJ for Brazilian companies,,True,unknown,https://www.receitaws.com.br/,Government
Brazilian Chamber of Deputies Open Data,"Provides legislative information in Apis XML and JSON, as well as files in various formats",,True,no,https://dadosabertos.camara.leg.br/swagger/api.html,Government
Census.gov,The US Census Bureau provides various APIs and data sets on demographics and businesses,,True,unknown,https://www.census.gov/data/developers/data-sets.html,Government
"City, Berlin",Berlin(DE) City Open Data,,True,unknown,https://daten.berlin.de/,Government
"City, Gdańsk",Gdańsk (PL) City Open Data,,True,unknown,https://ckan.multimediagdansk.pl/en,Government
"City, Gdynia",Gdynia (PL) City Open Data,,False,unknown,http://otwartedane.gdynia.pl/en/api_doc.html,Government
"City, Helsinki",Helsinki(FI) City Open Data,,True,unknown,https://hri.fi/en_gb/,Government
"City, Lviv",Lviv(UA) City Open Data,,True,unknown,https://opendata.city-adm.lviv.ua/,Government
"City, Nantes Open Data",Nantes(FR) City Open Data,apiKey,True,unknown,https://data.nantesmetropole.fr/pages/home/,Government
"City, New York Open Data",New York (US) City Open Data,,True,unknown,https://opendata.cityofnewyork.us/,Government
"City, Prague Open Data",Prague(CZ) City Open Data,,False,unknown,http://opendata.praha.eu/en,Government
"City, Toronto Open Data",Toronto (CA) City Open Data,,True,yes,https://open.toronto.ca/,Government
Code.gov,The primary platform for Open Source and code sharing for the U.S. Federal Government,apiKey,True,unknown,https://code.gov,Government
Colorado Information Marketplace,Colorado State Government Open Data,,True,unknown,https://data.colorado.gov/,Government
Data USA,US Public Data,,True,unknown,https://datausa.io/about/api/,Government
Data.gov,US Government Data,apiKey,True,unknown,https://api.data.gov/,Government
Data.parliament.uk,"Contains live datasets including information about petitions, bills, MP votes, attendance and more",,False,unknown,https://explore.data.parliament.uk/?learnmore=Members,Government
Deutscher Bundestag DIP,"This API provides read access to DIP entities (e.g. activities, persons, printed material)",apiKey,True,unknown,https://dip.bundestag.de/documents/informationsblatt_zur_dip_api_v01.pdf,Government
District of Columbia Open Data,"Contains D.C. government public datasets, including crime, GIS, financial data, and so on",,True,unknown,http://opendata.dc.gov/pages/using-apis,Government
EPA,Web services and data sets from the US Environmental Protection Agency,,True,unknown,https://www.epa.gov/developers/data-data-products#apis,Government
FBI Wanted,Access information on the FBI Wanted program,,True,unknown,https://www.fbi.gov/wanted/api,Government
FEC,Information on campaign donations in federal elections,apiKey,True,unknown,https://api.open.fec.gov/developers/,Government
Federal Register,The Daily Journal of the United States Government,,True,unknown,https://www.federalregister.gov/reader-aids/developer-resources/rest-api,Government
Food Standards Agency,UK food hygiene rating data API,,False,unknown,http://ratings.food.gov.uk/open-data/en-GB,Government
"Gazette Data, UK",UK official public record API,OAuth,True,unknown,https://www.thegazette.co.uk/data,Government
Gun Policy,International firearm injury prevention and policy,apiKey,True,unknown,https://www.gunpolicy.org/api,Government
INEI,Peruvian Statistical Government Open Data,,False,unknown,http://iinei.inei.gob.pe/microdatos/,Government
Interpol Red Notices,Access and search Interpol Red Notices,,True,unknown,https://interpol.api.bund.dev/,Government
Istanbul (İBB) Open Data,Data sets from the İstanbul Metropolitan Municipality (İBB),,True,unknown,https://data.ibb.gov.tr,Government
"National Park Service, US",Data from the US National Park Service,apiKey,True,yes,https://www.nps.gov/subjects/developer/,Government
"Open Government, ACT",Australian Capital Territory Open Data,,True,unknown,https://www.data.act.gov.au/,Government
"Open Government, Argentina",Argentina Government Open Data,,True,unknown,https://datos.gob.ar/,Government
"Open Government, Australia",Australian Government Open Data,,True,unknown,https://www.data.gov.au/,Government
"Open Government, Austria",Austria Government Open Data,,True,unknown,https://www.data.gv.at/,Government
"Open Government, Belgium",Belgium Government Open Data,,True,unknown,https://data.gov.be/,Government
"Open Government, Canada",Canadian Government Open Data,,False,unknown,http://open.canada.ca/en,Government
"Open Government, Colombia",Colombia Government Open Data,,False,unknown,https://www.dane.gov.co/,Government
"Open Government, Cyprus",Cyprus Government Open Data,,True,unknown,https://data.gov.cy/?language=en,Government
"Open Government, Czech Republic",Czech Republic Government Open Data,,True,unknown,https://data.gov.cz/english/,Government
"Open Government, Denmark",Denmark Government Open Data,,True,unknown,https://www.opendata.dk/,Government
"Open Government, Estonia",Estonia Government Open Data,apiKey,True,unknown,https://avaandmed.eesti.ee/instructions/opendata-dataset-api,Government
"Open Government, Finland",Finland Government Open Data,,True,unknown,https://www.avoindata.fi/en,Government
"Open Government, France",French Government Open Data,apiKey,True,unknown,https://www.data.gouv.fr/,Government
"Open Government, Germany",Germany Government Open Data,,True,unknown,https://www.govdata.de/daten/-/details/govdata-metadatenkatalog,Government
"Open Government, Greece",Greece Government Open Data,OAuth,True,unknown,https://data.gov.gr/,Government
"Open Government, India",Indian Government Open Data,apiKey,True,unknown,https://data.gov.in/,Government
"Open Government, Ireland",Ireland Government Open Data,,True,unknown,https://data.gov.ie/pages/developers,Government
"Open Government, Italy",Italy Government Open Data,,True,unknown,https://www.dati.gov.it/,Government
"Open Government, Korea",Korea Government Open Data,apiKey,True,unknown,https://www.data.go.kr/,Government
"Open Government, Lithuania",Lithuania Government Open Data,,True,unknown,https://data.gov.lt/public/api/1,Government
"Open Government, Luxembourg",Luxembourgish Government Open Data,apiKey,True,unknown,https://data.public.lu,Government
"Open Government, Mexico",Mexican Statistical Government Open Data,,True,unknown,https://www.inegi.org.mx/datos/,Government
"Open Government, Mexico",Mexico Government Open Data,,True,unknown,https://datos.gob.mx/,Government
"Open Government, Netherlands",Netherlands Government Open Data,,True,unknown,https://data.overheid.nl/en/ondersteuning/data-publiceren/api,Government
"Open Government, New South Wales",New South Wales Government Open Data,apiKey,True,unknown,https://api.nsw.gov.au/,Government
"Open Government, New Zealand",New Zealand Government Open Data,,True,unknown,https://www.data.govt.nz/,Government
"Open Government, Norway",Norwegian Government Open Data,,True,yes,https://data.norge.no/dataservices,Government
"Open Government, Peru",Peru Government Open Data,,True,unknown,https://www.datosabiertos.gob.pe/,Government
"Open Government, Poland",Poland Government Open Data,,True,yes,https://dane.gov.pl/en,Government
"Open Government, Portugal",Portugal Government Open Data,,True,yes,https://dados.gov.pt/en/docapi/,Government
"Open Government, Queensland Government",Queensland Government Open Data,,True,unknown,https://www.data.qld.gov.au/,Government
"Open Government, Romania",Romania Government Open Data,,False,unknown,http://data.gov.ro/,Government
"Open Government, Saudi Arabia",Saudi Arabia Government Open Data,,True,unknown,https://data.gov.sa,Government
"Open Government, Singapore",Singapore Government Open Data,,True,unknown,https://data.gov.sg/developer,Government
"Open Government, Slovakia",Slovakia Government Open Data,,True,unknown,https://data.gov.sk/en/,Government
"Open Government, Slovenia",Slovenia Government Open Data,,True,no,https://podatki.gov.si/,Government
"Open Government, South Australian Government",South Australian Government Open Data,,True,unknown,https://data.sa.gov.au/,Government
"Open Government, Spain",Spain Government Open Data,,True,unknown,https://datos.gob.es/en,Government
"Open Government, Sweden",Sweden Government Open Data,,True,unknown,https://www.dataportal.se/en/dataservice/91_29789/api-for-the-statistical-database,Government
"Open Government, Switzerland",Switzerland Government Open Data,,True,unknown,https://handbook.opendata.swiss/de/content/nutzen/api-nutzen.html,Government
"Open Government, Taiwan",Taiwan Government Open Data,,True,unknown,https://data.gov.tw/,Government
"Open Government, Thailand",Thailand Government Open Data,apiKey,True,unknown,https://data.go.th/,Government
"Open Government, UK",UK Government Open Data,,True,unknown,https://data.gov.uk/,Government
"Open Government, USA",United States Government Open Data,,True,unknown,https://www.data.gov/,Government
"Open Government, Victoria State Government",Victoria State Government Open Data,,True,unknown,https://www.data.vic.gov.au/,Government
"Open Government, West Australia",West Australia Open Data,,True,unknown,https://data.wa.gov.au/,Government
PRC Exam Schedule,Unofficial Philippine Professional Regulation Commission's examination schedule,,True,yes,https://api.whenisthenextboardexam.com/docs/,Government
Represent by Open North,Find Canadian Government Representatives,,True,unknown,https://represent.opennorth.ca/,Government
UK Companies House,UK Companies House Data from the UK government,OAuth,True,unknown,https://developer.company-information.service.gov.uk/,Government
US Presidential Election Data by TogaTech,Basic candidate data and live electoral vote counts for top two parties in US presidential election,,True,no,https://uselection.togatech.org/api/,Government
USA.gov,"Authoritative information on U.S. programs, events, services and more",apiKey,True,unknown,https://www.usa.gov/developer,Government
USAspending.gov,US federal spending data,,True,unknown,https://api.usaspending.gov/,Government
CMS.gov,Access to the data from the CMS - medicare.gov,apiKey,True,unknown,https://data.cms.gov/provider-data/,Health
Coronavirus,HTTP API for Latest Covid-19 Data,,True,unknown,https://pipedream.com/@pravin/http-api-for-latest-wuhan-coronavirus-data-2019-ncov-p_G6CLVM/readme,Health
Coronavirus in the UK,"UK Government coronavirus data, including deaths and cases by region",,True,unknown,https://coronavirus.data.gov.uk/details/developers-guide,Health
Covid Tracking Project,Covid-19  data for the US,,True,no,https://covidtracking.com/data/api/version-2,Health
Covid-19,"Covid 19 spread, infection and recovery",,True,yes,https://covid19api.com/,Health
Covid-19,"Covid 19 cases, deaths and recovery per country",,True,yes,https://github.com/M-Media-Group/Covid-19-API,Health
Covid-19 Datenhub,"Maps, datasets, applications and more in the context of COVID-19",,True,unknown,https://npgeo-corona-npgeo-de.hub.arcgis.com,Health
Covid-19 Government Response,Government measures tracker to fight against the Covid-19 pandemic,,True,yes,https://covidtracker.bsg.ox.ac.uk,Health
Covid-19 India,"Covid 19 statistics state and district wise about cases, vaccinations, recovery within India",,True,unknown,https://data.covid19india.org/,Health
Covid-19 JHU CSSE,Open-source API for exploring Covid19 cases based on JHU CSSE,,True,yes,https://nuttaphat.com/covid19-api/,Health
Covid-19 Live Data,"Global and countrywise data of Covid 19 daily Summary, confirmed cases, recovered and deaths",,True,yes,https://github.com/mathdroid/covid-19-api,Health
Covid-19 Philippines,Unofficial Covid-19 Web API for Philippines from data collected by DOH,,True,yes,https://github.com/Simperfy/Covid-19-API-Philippines-DOH,Health
COVID-19 Tracker Canada,Details on Covid-19 cases across Canada,,True,unknown,https://api.covid19tracker.ca/docs/1.0/overview,Health
COVID-19 Tracker Sri Lanka,Provides situation of the COVID-19 patients reported in Sri Lanka,,True,unknown,https://www.hpb.health.gov.lk/en/api-documentation,Health
COVID-ID,Indonesian government Covid data per province,,True,yes,https://data.covid19.go.id/public/api/prov.json,Health
Dataflow Kit COVID-19,COVID-19 live statistics into sites per hour,,True,unknown,https://covid-19.dataflowkit.com,Health
FoodData Central,National Nutrient Database for Standard Reference,apiKey,True,unknown,https://fdc.nal.usda.gov/,Health
Healthcare.gov,Educational content about the US Health Insurance Marketplace,,True,unknown,https://www.healthcare.gov/developers/,Health
Humanitarian Data Exchange,Humanitarian Data Exchange (HDX) is open platform for sharing data across crises and organisations,,True,unknown,https://data.humdata.org/,Health
Infermedica,NLP based symptom checker and patient triage API for health diagnosis from text,apiKey,True,yes,https://developer.infermedica.com/docs/,Health
LAPIS,SARS-CoV-2 genomic sequences from public sources,,True,yes,https://cov-spectrum.ethz.ch/public,Health
Lexigram,"NLP that extracts mentions of clinical concepts from text, gives access to clinical ontology",apiKey,True,unknown,https://docs.lexigram.io/,Health
Makeup,Makeup Information,,False,unknown,http://makeup-api.herokuapp.com/,Health
MyVaccination,Vaccination data for Malaysia,,True,unknown,https://documenter.getpostman.com/view/16605343/Tzm8GG7u,Health
NPPES,"National Plan & Provider Enumeration System, info on healthcare providers registered in US",,True,unknown,https://npiregistry.cms.hhs.gov/registry/help-api,Health
Nutritionix,Worlds largest verified nutrition database,apiKey,True,unknown,https://developer.nutritionix.com/,Health
Open Data NHS Scotland,Medical reference data and statistics by Public Health Scotland,,True,unknown,https://www.opendata.nhs.scot,Health
Open Disease,API for Current cases and more stuff about COVID-19 and Influenza,,True,yes,https://disease.sh/,Health
openFDA,"Public FDA data about drugs, devices and foods",apiKey,True,unknown,https://open.fda.gov,Health
