API,Description,Auth,HTTPS,Cors,Link,Category
Orion Health,Medical platform which allows the development of applications for different healthcare scenarios,OAuth,True,unknown,https://developer.orionhealth.io/,Health
Quarantine,Coronavirus API with free COVID-19 live updates,,True,yes,https://quarantine.country/coronavirus/api/,Health
Adzuna,Job board aggregator,apiKey,True,unknown,https://developer.adzuna.com/overview,Jobs
Arbeitnow,API for Job board aggregator in Europe / Remote,,True,yes,https://documenter.getpostman.com/view/18545278/UVJbJdKh,Jobs
Arbeitsamt,"API for the ""Arbeitsamt"", which is a german Job board aggregator",OAuth,True,unknown,https://jobsuche.api.bund.dev/,Jobs
Careerjet,Job search engine,apiKey,False,unknown,https://www.careerjet.com/partners/api/,Jobs
DevITjobs UK,Jobs with GraphQL,,True,yes,https://devitjobs.uk/job_feed.xml,Jobs
Findwork,Job board,apiKey,True,unknown,https://findwork.dev/developers/,Jobs
GraphQL Jobs,Jobs with GraphQL,,True,yes,https://graphql.jobs/docs/api/,Jobs
Jobs2Careers,Job aggregator,apiKey,True,unknown,http://api.jobs2careers.com/api/spec.pdf,Jobs
Jooble,Job search engine,apiKey,True,unknown,https://jooble.org/api/about,Jobs
Juju,Job search engine,apiKey,False,unknown,http://www.juju.com/publisher/spec/,Jobs
Open Skills,"Job titles, skills and related jobs data",,False,unknown,https://github.com/workforce-data-initiative/skills-api/wiki/API-Overview,Jobs
Reed,Job board aggregator,apiKey,True,unknown,https://www.reed.co.uk/developers,Jobs
The Muse,Job board and company profiles,apiKey,True,unknown,https://www.themuse.com/developers/api/v2,Jobs
Upwork,Freelance job board and management system,OAuth,True,unknown,https://developers.upwork.com/,Jobs
USAJOBS,US government job board,apiKey,True,unknown,https://developer.usajobs.gov/,Jobs
WhatJobs,Job search engine,apiKey,True,unknown,https://www.whatjobs.com/affiliates,Jobs
ZipRecruiter,Job search app and website,apiKey,True,unknown,https://www.ziprecruiter.com/publishers,Jobs
AI For Thai,Free Various Thai AI API,apiKey,True,yes,https://aiforthai.in.th/index.php,Machine Learning
Clarifai,Computer Vision,OAuth,True,unknown,https://docs.clarifai.com/api-guide/api-overview,Machine Learning
Cloudmersive,"Image captioning, face recognition, NSFW classification",apiKey,True,yes,https://www.cloudmersive.com/image-recognition-and-processing-api,Machine Learning
Deepcode,AI for code review,,True,unknown,https://www.deepcode.ai,Machine Learning
Dialogflow,Natural Language Processing,apiKey,True,unknown,https://cloud.google.com/dialogflow/docs/,Machine Learning
EXUDE-API,"Used for the primary ways for filtering the stopping, stemming words from the text data",,True,yes,http://uttesh.com/exude-api/,Machine Learning
Hirak FaceAPI,"Face detection, face recognition with age estimation/gender estimation, accurate, no quota limits",apiKey,True,unknown,https://faceapi.hirak.site/,Machine Learning
Imagga,"Image Recognition Solutions like Tagging, Visual Search, NSFW moderation",apiKey,True,unknown,https://imagga.com/,Machine Learning
Inferdo,"Computer Vision services like Facial detection, Image labeling, NSFW classification",apiKey,True,unknown,https://rapidapi.com/user/inferdo,Machine Learning
IPS Online,Face and License Plate Anonymization,apiKey,True,unknown,https://docs.identity.ps/docs,Machine Learning
Irisnet,Realtime content moderation API that blocks or blurs unwanted images in real-time,apiKey,True,yes,https://irisnet.de/api/,Machine Learning
Keen IO,Data Analytics,apiKey,True,unknown,https://keen.io/,Machine Learning
Machinetutors,"AI Solutions: Video/Image Classification & Tagging, NSFW, Icon/Image/Audio Search, NLP",apiKey,True,yes,https://www.machinetutors.com/portfolio/MT_api.html,Machine Learning
MessengerX.io,A FREE API for developers to build and monetize personalized ML based chat apps,apiKey,True,yes,https://messengerx.rtfd.io,Machine Learning
NLP Cloud,"NLP API using spaCy and transformers for NER, sentiments, classification, summarization, and more",apiKey,True,unknown,https://nlpcloud.io,Machine Learning
OpenVisionAPI,Open source computer vision API based on open source models,,True,yes,https://openvisionapi.com,Machine Learning
Perspective,"NLP API to return probability that if text is toxic, obscene, insulting or threatening",apiKey,True,unknown,https://perspectiveapi.com,Machine Learning
Roboflow Universe,Pre-trained computer vision models,apiKey,True,yes,https://universe.roboflow.com,Machine Learning
SkyBiometry,"Face Detection, Face Recognition and Face Grouping",apiKey,True,unknown,https://skybiometry.com/documentation/,Machine Learning
Time Door,A time series analysis API,apiKey,True,yes,https://timedoor.io,Machine Learning
Unplugg,Forecasting API for timeseries data,apiKey,True,unknown,https://unplu.gg/test_api.html,Machine Learning
WolframAlpha,Provides specific answers to questions using data and algorithms,apiKey,True,unknown,https://products.wolframalpha.com/api/,Machine Learning
7digital,Api of Music store 7digital,OAuth,True,unknown,https://docs.7digital.com/reference,Music
AI Mastering,Automated Music Mastering,apiKey,True,yes,https://aimastering.com/api_docs/,Music
Audiomack,Api of the streaming music hub Audiomack,OAuth,True,unknown,https://www.audiomack.com/data-api/docs,Music
Bandcamp,API of Music store Bandcamp,OAuth,True,unknown,https://bandcamp.com/developer,Music
Bandsintown,Music Events,,True,unknown,https://app.swaggerhub.com/apis/Bandsintown/PublicAPI/3.0.0,Music
Deezer,Music,OAuth,True,unknown,https://developers.deezer.com/api,Music
Discogs,Music,OAuth,True,unknown,https://www.discogs.com/developers/,Music
Freesound,Music Samples,apiKey,True,unknown,https://freesound.org/docs/api/,Music
Gaana,API to retrieve song information from Gaana,,True,unknown,https://github.com/cyberboysumanjay/GaanaAPI,Music
Genius,Crowdsourced lyrics and music knowledge,OAuth,True,unknown,https://docs.genius.com/,Music
Genrenator,Music genre generator,,True,unknown,https://binaryjazz.us/genrenator-api/,Music
iTunes Search,Software products,,True,unknown,https://affiliate.itunes.apple.com/resources/documentation/itunes-store-web-service-search-api/,Music
Jamendo,Music,OAuth,True,unknown,https://developer.jamendo.com/v3.0/docs,Music
JioSaavn,"API to retrieve song information, album meta data and many more from JioSaavn",,True,unknown,https://github.com/cyberboysumanjay/JioSaavnAPI,Music
KKBOX,"Get music libraries, playlists, charts, and perform out of KKBOX's platform",OAuth,True,unknown,https://developer.kkbox.com,Music
KSoft.Si Lyrics,API to get lyrics for songs,apiKey,True,unknown,https://docs.ksoft.si/api/lyrics-api,Music
LastFm,Music,apiKey,True,unknown,https://www.last.fm/api,Music
Lyrics.ovh,Simple API to retrieve the lyrics of a song,,True,unknown,https://lyricsovh.docs.apiary.io,Music
Mixcloud,Music,OAuth,True,yes,https://www.mixcloud.com/developers/,Music
MusicBrainz,Music,,True,unknown,https://musicbrainz.org/doc/Development/XML_Web_Service/Version_2,Music
Musixmatch,Music,apiKey,True,unknown,https://developer.musixmatch.com/,Music
Napster,Music,apiKey,True,yes,https://developer.napster.com/api/v2.2,Music
Openwhyd,"Download curated playlists of streaming tracks (YouTube, SoundCloud, etc...)",,True,no,https://openwhyd.github.io/openwhyd/API,Music
Phishin,A web-based archive of legal live audio recordings of the improvisational rock band Phish,apiKey,True,no,https://phish.in/api-docs,Music
Radio Browser,List of internet radio stations,,True,yes,https://api.radio-browser.info/,Music
Songkick,Music Events,apiKey,True,unknown,https://www.songkick.com/developer/,Music
Songlink / Odesli,Get all the services on which a song is available,apiKey,True,yes,https://www.notion.so/API-d0ebe08a5e304a55928405eb682f6741,Music
Songsterr,"Provides guitar, bass and drums tabs and chords",,True,unknown,https://www.songsterr.com/a/wa/api/,Music
SoundCloud,With SoundCloud API you can build applications that will give more power to control your content,OAuth,True,unknown,https://developers.soundcloud.com/docs/api/guide,Music
Spotify,"View Spotify music catalog, manage users' libraries, get recommendations and more",OAuth,True,unknown,https://beta.developer.spotify.com/documentation/web-api/,Music
TasteDive,Similar artist API (also works for movies and TV shows),apiKey,True,unknown,https://tastedive.com/read/api,Music
TheAudioDB,Music,apiKey,True,unknown,https://www.theaudiodb.com/api_guide.php,Music
Vagalume,Crowdsourced lyrics and music knowledge,apiKey,True,unknown,https://api.vagalume.com.br/docs/,Music
apilayer mediastack,"Free, Simple REST API for Live News & Blog Articles",apiKey,True,unknown,https://mediastack.com/,News
Associated Press,Search for news and metadata from Associated Press,apiKey,True,unknown,https://developer.ap.org/,News
Chronicling America,Provides access to millions of pages of historic US newspapers from the Library of Congress,,False,unknown,http://chroniclingamerica.loc.gov/about/api/,News
Currents,"Latest news published in various news sources, blogs and forums",apiKey,True,yes,https://currentsapi.services/,News
Feedbin,RSS reader,OAuth,True,unknown,https://github.com/feedbin/feedbin-api,News
GNews,Search for news from various sources,apiKey,True,yes,https://gnews.io/,News
Graphs for Coronavirus,Each Country separately and Worldwide Graphs for Coronavirus. Daily updates,,True,yes,https://corona.dnsforfamily.com/api.txt,News
Inshorts News,Provides news from inshorts,,True,unknown,https://github.com/cyberboysumanjay/Inshorts-News-API,News
MarketAux,Live stock market news with tagged tickers + sentiment and stats JSON API,apiKey,True,yes,https://www.marketaux.com/,News
New York Times,The New York Times Developer Network,apiKey,True,unknown,https://developer.nytimes.com/,News
News,Headlines currently published on a range of news sources and blogs,apiKey,True,unknown,https://newsapi.org/,News
NewsData,News data API for live-breaking news and headlines from reputed  news sources,apiKey,True,unknown,https://newsdata.io/docs,News
NewsX,Get or Search Latest Breaking News with ML Powered Summaries 🤖,apiKey,True,unknown,https://rapidapi.com/machaao-inc-machaao-inc-default/api/newsx/,News
NPR One,Personalized news listening experience from NPR,OAuth,True,unknown,http://dev.npr.org/api/,News
Spaceflight News,Spaceflight related news 🚀,,True,yes,https://spaceflightnewsapi.net,News
The Guardian,"Access all the content the Guardian creates, categorised by tags and section",apiKey,True,unknown,http://open-platform.theguardian.com/,News
The Old Reader,RSS reader,apiKey,True,unknown,https://github.com/theoldreader/api,News
TheNews,"Aggregated headlines, top story and live news JSON API",apiKey,True,yes,https://www.thenewsapi.com/,News
Trove,Search through the National Library of Australia collection of 1000s of digitised newspapers,apiKey,True,unknown,https://trove.nla.gov.au/about/create-something/using-api,News
18F,Unofficial US Federal Government API Development,,False,unknown,http://18f.github.io/API-All-the-X/,Open Data
API Setu,"An Indian Government platform that provides a lot of APIS for KYC, business, education & employment",,True,yes,https://www.apisetu.gov.in/,Open Data
Archive.org,The Internet Archive,,True,no,https://archive.readme.io/docs,Open Data
Black History Facts,Contribute or search one of the largest black history fact databases on the web,apiKey,True,yes,https://www.blackhistoryapi.io/docs,Open Data
BotsArchive,JSON formatted details about Telegram Bots available in database,,True,unknown,https://botsarchive.com/docs.html,Open Data
Callook.info,United States ham radio callsigns,,True,unknown,https://callook.info,Open Data
CARTO,Location Information Prediction,apiKey,True,unknown,https://carto.com/,Open Data
CollegeScoreCard.ed.gov,Data on higher education institutions in the United States,,True,unknown,https://collegescorecard.ed.gov/data/,Open Data
Enigma Public,Broadest collection of public data,apiKey,True,yes,https://developers.enigma.com/docs,Open Data
French Address Search,Address search via the French Government,,True,unknown,https://geo.api.gouv.fr/adresse,Open Data
GENESIS,Federal Statistical Office Germany,OAuth,True,unknown,https://www.destatis.de/EN/Service/OpenData/api-webservice.html,Open Data
Joshua Project,People groups of the world with the fewest followers of Christ,apiKey,True,unknown,https://api.joshuaproject.net/,Open Data
Kaggle,"Create and interact with Datasets, Notebooks, and connect with Kaggle",apiKey,True,unknown,https://www.kaggle.com/docs/api,Open Data
LinkPreview,"Get JSON formatted summary with title, description and preview image for any requested URL",apiKey,True,yes,https://www.linkpreview.net,Open Data
Lowy Asia Power Index,Get measure resources and influence to rank the relative power of states in Asia,,True,unknown,https://github.com/0x0is1/lowy-index-api-docs,Open Data
Microlink.io,Extract structured data from any website,,True,yes,https://microlink.io,Open Data
Nasdaq Data Link,Stock market data,apiKey,True,unknown,https://docs.data.nasdaq.com/,Open Data
Nobel Prize,Open data about nobel prizes and events,,True,yes,https://www.nobelprize.org/about/developer-zone-2/,Open Data
Open Data Minneapolis,Spatial (GIS) and non-spatial city data for Minneapolis,,True,no,https://opendata.minneapolismn.gov/,Open Data
openAFRICA,Large datasets repository of African open data,,True,unknown,https://africaopendata.org/,Open Data
OpenCorporates,Data on corporate entities and directors in many countries,apiKey,True,unknown,http://api.opencorporates.com/documentation/API-Reference,Open Data
OpenSanctions,"Data on international sanctions, crime and politically exposed persons",,True,yes,https://www.opensanctions.org/docs/api/,Open Data
PeakMetrics,News articles and public datasets,apiKey,True,unknown,https://rapidapi.com/peakmetrics-peakmetrics-default/api/peakmetrics-news,Open Data
Recreation Information Database,"Recreational areas, federal lands, historic sites, museums, and other attractions/resources(US)",apiKey,True,unknown,https://ridb.recreation.gov/,Open Data
Scoop.it,Content Curation Service,apiKey,False,unknown,http://www.scoop.it/dev,Open Data
Socrata,"Access to Open Data from Governments, Non-profits and NGOs around the world",OAuth,True,yes,https://dev.socrata.com/,Open Data
Teleport,Quality of Life Data,,True,unknown,https://developers.teleport.org/,Open Data
Umeå Open Data,Open data of the city Umeå in northen Sweden,,True,yes,https://opendata.umea.se/api/,Open Data
Universities List,"University names, countries and domains",,True,unknown,https://github.com/Hipo/university-domains-list,Open Data
University of Oslo,"Courses, lecture videos, detailed information for courses etc. for the University of Oslo (Norway)",,True,unknown,https://data.uio.no/,Open Data
UPC database,More than 1.5 million barcode numbers from all around the world,apiKey,True,unknown,https://upcdatabase.org/api,Open Data
Urban Observatory,The largest set of publicly available real time urban data in the UK,,False,no,https://urbanobservatory.ac.uk,Open Data
Wikidata,Collaboratively edited knowledge base operated by the Wikimedia Foundation,OAuth,True,unknown,https://www.wikidata.org/w/api.php?action=help,Open Data
Wikipedia,Mediawiki Encyclopedia,,True,unknown,https://www.mediawiki.org/wiki/API:Main_page,Open Data
Yelp,Find Local Business,OAuth,True,unknown,https://www.yelp.com/developers/documentation/v3,Open Data
Countly,Countly web analytics,,False,unknown,https://api.count.ly/reference,Open Source Projects
Creative Commons Catalog,Search among openly licensed and public domain works,OAuth,True,yes,https://api.creativecommons.engineering/,Open Source Projects
Datamuse,Word-finding query engine,,True,unknown,https://www.datamuse.com/api/,Open Source Projects
Drupal.org,Drupal.org,,True,unknown,https://www.drupal.org/drupalorg/docs/api,Open Source Projects
Evil Insult Generator,Evil Insults,,True,yes,https://evilinsult.com/api,Open Source Projects
GitHub Contribution Chart Generator,Create an image of your GitHub contributions,,True,yes,https://github-contributions.vercel.app,Open Source Projects
GitHub ReadMe Stats,Add dynamically generated statistics to your GitHub profile ReadMe,,True,yes,https://github.com/anuraghazra/github-readme-stats,Open Source Projects
Metabase,An open source Business Intelligence server to share data and analytics inside your company,,True,yes,https://www.metabase.com/,Open Source Projects
Shields,"Concise, consistent, and legible badges in SVG and raster format",,True,unknown,https://shields.io/,Open Source Projects
EPO,European patent search system api,OAuth,True,unknown,https://developers.epo.org/,Patent
PatentsView ,API is intended to explore and visualize trends/patterns across the US innovation landscape,,True,unknown,https://patentsview.org/apis/purpose,Patent
TIPO,Taiwan patent search system api,apiKey,True,unknown,https://tiponet.tipo.gov.tw/Gazette/OpenData/OD/OD05.aspx?QryDS=API00,Patent
USPTO,USA patent api services,,True,unknown,https://www.uspto.gov/learning-and-resources/open-data-and-mobility,Patent
Advice Slip,Generate random advice slips,,True,unknown,http://api.adviceslip.com/,Personality
Biriyani As A Service,Biriyani images placeholder,,True,no,https://biriyani.anoram.com/,Personality
Dev.to,"Access Forem articles, users and other resources via API",apiKey,True,unknown,https://developers.forem.com/api,Personality
Dictum,API to get access to the collection of the most inspiring expressions of mankind,,True,unknown,https://github.com/fisenkodv/dictum,Personality
FavQs.com,"FavQs allows you to collect, discover and share your favorite quotes",apiKey,True,unknown,https://favqs.com/api,Personality
FOAAS,Fuck Off As A Service,,False,unknown,http://www.foaas.com/,Personality
Forismatic,Inspirational Quotes,,False,unknown,http://forismatic.com/en/api/,Personality
icanhazdadjoke,The largest selection of dad jokes on the internet,,True,unknown,https://icanhazdadjoke.com/api,Personality
Inspiration,Motivational and Inspirational quotes,,True,yes,https://inspiration.goprogram.ai/docs/,Personality
kanye.rest,REST API for random Kanye West quotes,,True,yes,https://kanye.rest,Personality
kimiquotes,Team radio and interview quotes by Finnish F1 legend Kimi Räikkönen,,True,yes,https://kimiquotes.herokuapp.com/doc,Personality
Medium,Community of readers and writers offering unique perspectives on ideas,OAuth,True,unknown,https://github.com/Medium/medium-api-docs,Personality
Programming Quotes,Programming Quotes API for open source projects,,True,unknown,https://github.com/skolakoda/programming-quotes-api,Personality
Quotable Quotes,"Quotable is a free, open source quotations API",,True,unknown,https://github.com/lukePeavey/quotable,Personality
Quote Garden,REST API for more than 5000 famous quotes,,True,unknown,https://pprathameshmore.github.io/QuoteGarden/,Personality
quoteclear,Ever-growing list of James Clear quotes from the 3-2-1 Newsletter,,True,yes,https://quoteclear.web.app/,Personality
Quotes on Design,Inspirational Quotes,,True,unknown,https://quotesondesign.com/api/,Personality
Stoicism Quote,Quotes about Stoicism,,True,unknown,https://github.com/tlcheah2/stoic-quote-lambda-public-api,Personality
They Said So Quotes,Quotes Trusted by many fortune brands around the world,,True,unknown,https://theysaidso.com/api/,Personality
Traitify,"Assess, collect and analyze Personality",,True,unknown,https://app.traitify.com/developer,Personality
Udemy(instructor),API for instructors on Udemy,apiKey,True,unknown,https://www.udemy.com/developers/instructor/,Personality
Vadivelu HTTP Codes,On demand HTTP Codes with images,,True,no,https://vadivelu.anoram.com/,Personality
Zen Quotes,Large collection of Zen quotes for inspiration,,True,yes,https://zenquotes.io/,Personality
Abstract Phone Validation,Validate phone numbers globally,apiKey,True,yes,https://www.abstractapi.com/phone-validation-api,Phone
apilayer numverify,Phone number validation,apiKey,True,unknown,https://numverify.com,Phone
Cloudmersive Validate,Validate international phone numbers,apiKey,True,yes,https://cloudmersive.com/phone-number-validation-API,Phone
Phone Specification,Rest Api for Phone specifications,,True,yes,https://github.com/azharimm/phone-specs-api,Phone
Veriphone,Phone number validation & carrier lookup,apiKey,True,yes,https://veriphone.io,Phone
apilayer screenshotlayer,URL 2 Image,,True,unknown,https://screenshotlayer.com,Photography
APITemplate.io,Dynamically generate images and PDFs from templates with a simple API,apiKey,True,yes,https://apitemplate.io,Photography
Bruzu,Image generation with query string,apiKey,True,yes,https://docs.bruzu.com,Photography
CheetahO,Photo optimization and resize,apiKey,True,unknown,https://cheetaho.com/docs/getting-started/,Photography
Dagpi,Image manipulation and processing,apiKey,True,unknown,https://dagpi.xyz,Photography
Duply,"Generate, Edit, Scale and Manage Images and Videos Smarter & Faster",apiKey,True,yes,https://duply.co/docs#getting-started-api,Photography
DynaPictures,Generate Hundreds of Personalized Images in Minutes,apiKey,True,yes,https://dynapictures.com/docs/,Photography
Flickr,Flickr Services,OAuth,True,unknown,https://www.flickr.com/services/api/,Photography
Getty Images,Build applications using the world's most powerful imagery,OAuth,True,unknown,http://developers.gettyimages.com/en/,Photography
Gfycat,Jiffier GIFs,OAuth,True,unknown,https://developers.gfycat.com/api/,Photography
Giphy,Get all your gifs,apiKey,True,unknown,https://developers.giphy.com/docs/,Photography
Google Photos,Integrate Google Photos with your apps or devices,OAuth,True,unknown,https://developers.google.com/photos,Photography
Imgur,Images,OAuth,True,unknown,https://apidocs.imgur.com/,Photography
Imsea,Free image search,,True,unknown,https://imsea.herokuapp.com/,Photography
Lorem Picsum,Images from Unsplash,,True,unknown,https://picsum.photos/,Photography
ObjectCut,Image Background removal,apiKey,True,yes,https://objectcut.com/,Photography
Pexels,Free Stock Photos and Videos,apiKey,True,yes,https://www.pexels.com/api/,Photography
PhotoRoom,Remove background from images,apiKey,True,unknown,https://www.photoroom.com/api/,Photography
Pixabay,Photography,apiKey,True,unknown,https://pixabay.com/sk/service/about/api/,Photography
PlaceKeanu,Resizable Keanu Reeves placeholder images with grayscale and young Keanu options,,True,unknown,https://placekeanu.com/,Photography
Readme typing SVG,Customizable typing and deleting text SVG,,True,unknown,https://github.com/DenverCoder1/readme-typing-svg,Photography
Remove.bg,Image Background removal,apiKey,True,unknown,https://www.remove.bg/api,Photography
ReSmush.it,Photo optimization,,False,unknown,https://resmush.it/api,Photography
shutterstock,Stock Photos and Videos,OAuth,True,unknown,https://api-reference.shutterstock.com/,Photography
Sirv,"Image management solutions like optimization, manipulation, hosting",apiKey,True,unknown,https://apidocs.sirv.com/,Photography
Unsplash,Photography,OAuth,True,unknown,https://unsplash.com/developers,Photography
Wallhaven,Wallpapers,apiKey,True,unknown,https://wallhaven.cc/help/api,Photography
Webdam,Images,OAuth,True,unknown,https://www.damsuccess.com/hc/en-us/articles/202134055-REST-API,Photography
Codeforces,Get access to Codeforces data,apiKey,True,unknown,https://codeforces.com/apiHelp,Programming
Hackerearth,For compiling and running code in several languages,apiKey,True,unknown,https://www.hackerearth.com/docs/wiki/developers/v4/,Programming
Judge0 CE,Online code execution system,apiKey,True,unknown,https://ce.judge0.com/,Programming
KONTESTS,For upcoming and ongoing competitive coding contests,,True,unknown,https://kontests.net/api,Programming
Mintlify,For programmatically generating documentation for code,apiKey,True,yes,https://docs.mintlify.com,Programming
arcsecond.io,Multiple astronomy data sources,,True,unknown,https://api.arcsecond.io/,Science & Math
arXiv,"Curated research-sharing platform: physics, mathematics, quantitative finance, and economics",,True,unknown,https://arxiv.org/help/api/user-manual,Science & Math
CORE,Access the world's Open Access research papers,apiKey,True,unknown,https://core.ac.uk/services#api,Science & Math
GBIF,Global Biodiversity Information Facility,,True,yes,https://www.gbif.org/developer/summary,Science & Math
iDigBio,Access millions of museum specimens from organizations around the world,,True,unknown,https://github.com/idigbio/idigbio-search-api/wiki,Science & Math
inspirehep.net,High Energy Physics info. system,,True,unknown,https://github.com/inspirehep/rest-api-doc,Science & Math
isEven (humor),Check if a number is even,,True,unknown,https://isevenapi.xyz/,Science & Math
ISRO,ISRO Space Crafts Information,,True,no,https://isro.vercel.app,Science & Math
ITIS,Integrated Taxonomic Information System,,True,unknown,https://www.itis.gov/ws_description.html,Science & Math
Launch Library 2,Spaceflight launches and events database,,True,yes,https://thespacedevs.com/llapi,Science & Math
Materials Platform for Data Science,Curated experimental data for materials science,apiKey,True,no,https://mpds.io,Science & Math
Minor Planet Center,Asterank.com Information,,False,unknown,http://www.asterank.com/mpc,Science & Math
NASA,"NASA data, including imagery",,True,no,https://api.nasa.gov,Science & Math
NASA ADS,NASA Astrophysics Data System,OAuth,True,yes,https://ui.adsabs.harvard.edu/help/api/api-docs.html,Science & Math
Newton,Symbolic and Arithmetic Math Calculator,,True,no,https://newton.vercel.app,Science & Math
Noctua,REST API used to access NoctuaSky features,,True,unknown,https://api.noctuasky.com/api/v1/swaggerdoc/,Science & Math
Numbers,"Number of the day, random number, number facts and anything else you want to do with numbers",apiKey,True,no,https://math.tools/api/numbers/,Science & Math
Numbers,Facts about numbers,,False,no,http://numbersapi.com,Science & Math
